id,subreddit,author,score,title,domain,url,created_utc
i2177k,pics,JohnnyTeardrop,68331,"Person has balls, every other neighbor has Trump signs up",i.redd.it,https://i.redd.it/p2urui2gwge51.jpg,2020-08-01 22:30:34
i21fyx,Whatcouldgowrong,noondo_-nibba,18505,Using a Walmart bag when bleaching your hair,i.redd.it,https://i.redd.it/9x6jz7n8zge51.jpg,2020-08-01 22:45:57
i219fo,mildlyinteresting,TheDangerStranger,15118,This plaque at the dog park commemorating a park record,i.redd.it,https://i.redd.it/ggdu6e5awge51.jpg,2020-08-01 22:34:24
i1ymag,todayilearned,pm-me-gps-coords,58232,"TIL most Americans support eliminating the penny but attempts to do so have been stopped by Jarden Zinc Products, the sole provider of zinc penny blanks. Canada eliminated their penny in 2012.",en.wikipedia.org,https://en.wikipedia.org/wiki/Penny_debate_in_the_United_States,2020-08-01 20:04:19
i20dhv,AnimalCrossing,kbrezinobody,14493,"Not mine, saw this on Facebook and had to share it with you guys! 😂 I never thought about it this way 😂",i.redd.it,https://i.redd.it/x65j6ubcnge51.jpg,2020-08-01 21:39:16
i1z01i,gaming,ClaustrophobicSting,32347,"Not mine, but thought it would suit here :-)",i.redd.it,https://i.redd.it/3twyeha89ge51.jpg,2020-08-01 20:20:11
i1ydw6,PublicFreakout,p14082003,38497,"Coronavirus car playing coffin dance music in Buenos Aires, Argentina. (My life is now complete)",v.redd.it,https://v.redd.it/i30t02an3ge51,2020-08-01 19:49:25
i1xyj2,politics,Twoweekswithpay,20096,Trump Impeachment Witness Lt. Col. Vindman Says U.S. Government Now Reminiscent of Soviet-Style Regime,newsweek.com,https://www.newsweek.com/trump-impeachment-witness-lt-col-vindman-says-us-government-now-reminiscent-soviet-style-regime-1522160,2020-08-01 19:24:37
i1z9qc,CrappyDesign,lol62056,18835,“Critical thinking”,i.redd.it,https://i.redd.it/7fk0d8qtbge51.jpg,2020-08-01 20:34:42
i20riy,WatchPeopleDieInside,FacelessOnes,11391,98-yr old gramps can't handle the truth,v.redd.it,https://v.redd.it/omz9oyfarge51,2020-08-01 22:02:51
i1ydvk,Cringetopia,Maplegum,30399,"Change the world, my final message, goodbye.",i.redd.it,https://i.redd.it/nj3yd7ya3ge51.jpg,2020-08-01 19:49:23
i1y513,nextfuckinglevel,regian24,39890,Soap bubble freezing in real time,v.redd.it,https://v.redd.it/mlkdaeuv0ge51,2020-08-01 19:35:14
i1z1d0,interestingasfuck,dahnashk,21902,These carvings my dad made out of pencils in 1993,i.redd.it,https://i.redd.it/rbb4wffk9ge51.jpg,2020-08-01 20:22:10
i1wxqb,funny,theesmaarkhan,87293,Dogs playing...Can't understand the rule of this game though.,v.redd.it,https://v.redd.it/sh0aw23hofe51,2020-08-01 18:24:29
i1xk6k,aww,Sugar_Boom,105090,What could be more wholesome than this,i.redd.it,https://i.redd.it/aqd7ghh4vfe51.jpg,2020-08-01 19:01:08
i205u7,pcmasterrace,Conflict63,9155,"After years of use, I finally decided to hit the buy button",i.redd.it,https://i.redd.it/q3mavymwkge51.png,2020-08-01 21:26:13
i1zptk,FuckYouKaren,maazmellow,12743,Damn Karen,i.redd.it,https://i.redd.it/uadn6oc6gge51.jpg,2020-08-01 20:59:06
i1yxt1,WhitePeopleTwitter,codallas,11358,Hank would be so proud,i.redd.it,https://i.redd.it/n6ueclfe8ge51.jpg,2020-08-01 20:17:41
i20ndy,Wellthatsucks,DirePegasus,8056,"With my remaining 3% battery on my phone, I post this",i.redd.it,https://i.redd.it/xd69e1ibqge51.jpg,2020-08-01 21:55:59
i1xf77,wholesomememes,Urk4,42397,Thank you parents,i.redd.it,https://i.redd.it/07ah892ptfe51.jpg,2020-08-01 18:53:06
i1xdvr,dndmemes,JHossBoss,21942,"NPC idea: a rogue who pretends to be a wizard and uses stealth to do the ""magic."" H.P. Lovecraft: been there, done that.",i.redd.it,https://i.redd.it/bho10tobtfe51.jpg,2020-08-01 18:51:01
i21jqn,LifeProTips,pikcoolski,5101,"LPT, practice the pause.. Pause before assuming. Pause before accusing. Pause whenever you’re about to react harshly and you’ll avoid doing/saying things you’ll regret more often.",self.LifeProTips,https://www.reddit.com/r/LifeProTips/comments/i21jqn/lpt_practice_the_pause_pause_before_assuming/,2020-08-01 22:52:49
i1yexq,memes,zakuria44,62606,congratulations you played your self,i.redd.it,https://i.redd.it/8k9jzc1d3ge51.jpg,2020-08-01 19:51:08
i1wzem,facepalm,yomamascub,33029,One day...,i.redd.it,https://i.redd.it/0qgf6j63pfe51.jpg,2020-08-01 18:27:16
i1x5hc,gifs,Malachi_Noel3,19370,"""Leap of Faith"" waterslide in Dubai",i.imgur.com,https://i.imgur.com/hK2qrsU.gifv,2020-08-01 18:37:14
i1yj5p,rareinsults,dlmDarkFire,18257,Sad love life,i.imgur.com,https://i.imgur.com/dtedkql.png,2020-08-01 19:58:46
i1xels,LeopardsAteMyFace,Danceinthepurplerain,11140,"GOP railed against mail-in voting to try to depress turnout, suddenly realizes they might suffer as a result of these efforts",thehill.com,https://thehill.com/homenews/campaign/510040-gop-fears-trump-attacks-on-mail-in-vote-will-sabotage-turnout,2020-08-01 18:52:08
i1z89s,videos,vertmart,7795,"Putting On 10 Masks &amp; Running 1 Km In 100°F Heat, After Smoking, To Prove Masks Can't Suffocate You",youtube.com,https://www.youtube.com/watch?v=HaMlNjzgj2E,2020-08-01 20:32:32
i1w807,MadeMeSmile,edestron,55549,Parents adopt a kid they've been caring for as a Christmas surprise,v.redd.it,https://v.redd.it/8vab58s2hfe51,2020-08-01 17:42:46
i1w4s7,news,gharrity,35083,Ellen: hit talkshow in crisis amid revelations of toxic workplace culture,theguardian.com,https://www.theguardian.com/tv-and-radio/2020/aug/01/ellen-degeneres-show-sexual-misconduct-racism-allegations,2020-08-01 17:37:33
i1xkb0,me_irl,Arcaedus,18221,me_irl,i.redd.it,https://i.redd.it/91lt3yr3vfe51.png,2020-08-01 19:01:19
i1xtug,lotrmemes,mamadpri,14142,If only this happened,i.redd.it,https://i.redd.it/dughohruxfe51.jpg,2020-08-01 19:16:45
i1y2km,Minecraft,shifty_pickle,39176,Half a million blocks and 4 years later...,v.redd.it,https://v.redd.it/we931f4b0ge51,2020-08-01 19:31:21
i1xyfh,dankmemes,sugimateasu,52228,"For the people, by the people",i.redd.it,https://i.redd.it/o9joakkazfe51.jpg,2020-08-01 19:24:28
i1w369,instant_regret,St0pX,44408,Dog touches insect and instantly regrets it.,imgur.com,https://imgur.com/9mqqFXk.gifv,2020-08-01 17:35:01
i1xjou,photoshopbattles,confibulator,10661,PsBattle: Cracked Pomegranate,i.imgur.com,https://i.imgur.com/YfcKJ3e.jpg,2020-08-01 19:00:21
i1w4hs,blursedimages,MILDREDKING489,64733,blursed spongebob,i.redd.it,https://i.redd.it/gj9wrzq172e31.jpg,2020-08-01 17:37:07
i1vkxs,Coronavirus,silentonc,18662,"'I'm fighting a war against COVID-19 and a war against stupidity,' says CMO of Houston hospital : After two hours of sleep a night for four months and seeing a member of his team contract the virus, Joseph Varon, MD, is growing exasperated.",beckershospitalreview.com,https://www.beckershospitalreview.com/hospital-physician-relationships/i-m-fighting-a-war-against-covid-19-and-a-war-against-stupidity-says-cmo-of-houston-hospital.html,2020-08-01 17:04:59
i1yz75,NatureIsFuckingLit,lol62056,8396,🔥 The Goldentail moray eel looks like a banana peel,i.imgur.com,https://i.imgur.com/EqYaInw.gifv,2020-08-01 20:19:02
i1wfqg,gatekeeping,planet-lizard,18088,The best comeback for generational gate keeping,i.redd.it,https://i.redd.it/608eydjejfe51.jpg,2020-08-01 17:55:24
i1vllq,TheLastAirbender,jekkemenn,49535,Thought you guys might appreciate this recreation of the opening that I just finished working on with some friends... Let me know what you think! (Credits in Comments),v.redd.it,https://v.redd.it/m7m8acb0afe51,2020-08-01 17:06:03
i1v87p,BlackPeopleTwitter,Bmchris44,43687,is it over yet?,i.redd.it,https://i.redd.it/evc76jfe6fe51.png,2020-08-01 16:43:30
i1zs16,chloe,SrGrafo,5560,Chloe #140 - NOM NOM NOM,i.redd.it,https://i.redd.it/yy8hvcplgge51.jpg,2020-08-01 21:02:41
i20vs1,modernwarfare,ADeerBoy,4141,"The infected were having a hard time, so I gave them a hand",v.redd.it,https://v.redd.it/1l2hxlojsge51,2020-08-01 22:10:08
i1y4ta,DnDGreentext,Jack5594,6943,Great taste imo,i.redd.it,https://i.redd.it/iqn8jpm51ge51.jpg,2020-08-01 19:34:56
i1x4l0,Gunners,Bushuazoo,10002,ARSENAL WIN THE FA CUP! 🏆,twitter.com,https://twitter.com/brfootball/status/1289630578505969667?s=09,2020-08-01 18:35:41
i1xofl,tumblr,I_Did_Something_Nice,10081,This post seems universal,i.redd.it,https://i.redd.it/nju1hiqcwfe51.jpg,2020-08-01 19:08:02
i1zf90,WTF,yvesroyce2,5343,Meanwhile in Florida,v.redd.it,https://v.redd.it/5hqtzvuybge51,2020-08-01 20:42:51
i210zw,PrequelMemes,WH4Lomg,5325,Hello There 👀,i.redd.it,https://i.redd.it/ep3amupiuge51.jpg,2020-08-01 22:19:29
i1uzhn,freefolk,stonerplumber,27938,D and D really subverted expectations on this one,i.redd.it,https://i.redd.it/dnpuf6404fe51.jpg,2020-08-01 16:29:07
i1we14,holdmyredbull,RedBullTastesLikeCok,12317,Bond. . . . James Bond.,v.redd.it,https://v.redd.it/nwjvnxyoife51,2020-08-01 17:52:35
i1zc7d,VALORANT,Zephyrrrrrrr,5277,The Knife is the worst weapon in Valorant.,v.redd.it,https://v.redd.it/6k93gl9v9ge51,2020-08-01 20:38:23
i1wkpw,AskReddit,El_CM,17255,What is just a placebo effect but most people don't realize?,self.AskReddit,https://www.reddit.com/r/AskReddit/comments/i1wkpw/what_is_just_a_placebo_effect_but_most_people/,2020-08-01 18:03:30
i1v10l,rarepuppers,c00ldude7099,30149,My pupper has a heart shaped spot,i.redd.it,https://i.redd.it/rnb2t1mg4fe51.jpg,2020-08-01 16:31:39
i1wcdo,starterpacks,Colin_Bowell,16920,Aging rock band that hasn't put out a good record in a decade starter pack,i.redd.it,https://i.redd.it/c77t02lfife51.jpg,2020-08-01 17:49:58
i1ujgc,UpliftingNews,PatatasFrittas,30662,Sea turtles in Greece thrive as result of coronavirus lockdown and downturn in tourism,telegraph.co.uk,https://www.telegraph.co.uk/news/2020/07/30/turtles-greece-thrive-result-coronavirus-lockdown-downturn-tourism/,2020-08-01 16:01:36
i1ux1f,comics,WeFlapsComics,22330,So fast [OC],i.redd.it,https://i.redd.it/31qreqe93fe51.jpg,2020-08-01 16:24:55
i1v0cz,wallstreetbets,Spaldo18,15719,Scientific proof to inverse WSB,i.redd.it,https://i.redd.it/oyy6eql94fe51.jpg,2020-08-01 16:30:33
i1vwz2,NintendoSwitch,joe691013,11062,"Nintendo is removing Animal Crossing New Horizons islands that have ""hacked"" or ""cheated"" items because a youtuber is reporting them in his videos",switcher.gg,https://switcher.gg/s/news/dream-island-hacked-uploads-in-animal-crossing-new-horizons-deleted-by-nintendo-verlisify-reporting/,2020-08-01 17:25:07
i20onq,pussypassdenied,sewer_pickles,3575,"Didn't ask for help, but blames others for bad manners",i.redd.it,https://i.redd.it/wzgeay2bqge51.jpg,2020-08-01 21:58:09
i1ynu0,hockey,PaperMoonShine,4542,The Chicago Blackhawks have scored more goals in 1 playoff period than their entire series with Nashville in 2017.,self.hockey,https://www.reddit.com/r/hockey/comments/i1ynu0/the_chicago_blackhawks_have_scored_more_goals_in/,2020-08-01 20:06:14
i1urfu,baseball,redditcontrolme_enon,16834,José Altuve gets hit by a pitch then thrown out at second,v.redd.it,https://v.redd.it/uwk5n1ve1fe51,2020-08-01 16:15:09
i1tuz0,worldnews,Balls_of_Adamanthium,49283,Anti-Putin protest in Russia’s far east attracts thousands for a fourth weekend,independent.co.uk,https://www.independent.co.uk/news/world/europe/russia-anti-putin-protest-sergei-furgal-a9649466.html,2020-08-01 15:19:46
i20gvd,todayilearned,wintering6,6459,TIL that Louis Armstrong always wore a Star of David as an homage to a Jewish family that took him in when he was young and gave him his first horn,history.com,https://www.history.com/news/9-things-you-may-not-know-about-louis-armstrong,2020-08-01 21:44:54
i1xxh1,CasualUK,rumbelows,5555,Birthday card from my best mate arrived..,i.redd.it,https://i.redd.it/ld57qt3wyfe51.jpg,2020-08-01 19:22:48
i1xlmz,EarthPorn,UllrHellfire,6090,"Mount Rainier National Park, [2252x4000] [OC]",i.redd.it,https://i.redd.it/5t8v6iijvfe51.jpg,2020-08-01 19:03:28
i1ueh9,fakehistoryporn,Strindberg,30277,"Albert Einstein and his daughter left hanging during the the Great High Five Shortage [October 1st, 1940]",i.redd.it,https://i.redd.it/barudyixvee51.jpg,2020-08-01 15:53:01
i1zupy,oddlysatisfying,xGAMERG33Kx,4710,Turn on sound for that little extra layer of satisfaction,v.redd.it,https://v.redd.it/l8cfsq5hhge51,2020-08-01 21:07:01
i1zkyk,MaliciousCompliance,Holdfireblondie,3802,Lesson Plans Must Be Posted By The Door,self.MaliciousCompliance,https://www.reddit.com/r/MaliciousCompliance/comments/i1zkyk/lesson_plans_must_be_posted_by_the_door/,2020-08-01 20:51:13
i1w8ch,Eyebleach,lol62056,13214,Wedding turtle,i.imgur.com,https://i.imgur.com/RNZsvsO.jpg,2020-08-01 17:43:20
i1xkfs,funny,TheJenkinsComic,21102,Beatboxing,i.redd.it,https://i.redd.it/7ef5fpx6vfe51.png,2020-08-01 19:01:32
i1wgze,PoliticalCompassMemes,manly_braixen,12346,"Wanted to do this since a while ago (it's my first post, yay)",i.redd.it,https://i.redd.it/07at6kkljfe51.jpg,2020-08-01 17:57:26
i1xuf6,Steam,nerfMakoa,5148,The invisible cunt,i.redd.it,https://i.redd.it/25po92v2yfe51.jpg,2020-08-01 19:17:41
i1vx78,iamatotalpieceofshit,FeedingTube07,13810,"People shot up the windows of engines at a Railroad Museum in Indiana, just why?",i.redd.it,https://i.redd.it/vf0uzt42efe51.jpg,2020-08-01 17:25:28
i1upyo,AdviceAnimals,BillTowne,24224,"Scumbag Trump-in-Law, Jared Kushner",imgur.com,https://imgur.com/6skpT3Z,2020-08-01 16:12:34
i1v684,nonononoyes,Scaulbylausis,13682,Not today,i.imgur.com,https://i.imgur.com/pcfOhst.gifv,2020-08-01 16:40:05
i1xcw5,JusticeServed,ssdgm_19,7018,Want a fight? I’ll give you a fight,v.redd.it,https://v.redd.it/pzie2jx7gbe51,2020-08-01 18:49:21
i1u8qh,YouShouldKnow,alexsangthat,61216,"YSK that if you have children, or even just someone who really loves you, you shouldn’t avoid being in pictures",self.YouShouldKnow,https://www.reddit.com/r/YouShouldKnow/comments/i1u8qh/ysk_that_if_you_have_children_or_even_just/,2020-08-01 15:42:48
i1x30h,teenagers,TheSugarySugarySugar,36820,"My girlfriend just said ""if you don't get off reddit and spend some time with me I will drag your fucking face all over the keyboard""",self.teenagers,https://www.reddit.com/r/teenagers/comments/i1x30h/my_girlfriend_just_said_if_you_dont_get_off/,2020-08-01 18:33:07
i1x5w2,whatisthisthing,mrbojanglez69,6251,"Found in the backyard of a house, about 1 foot across, metal and built into the ground",i.redd.it,https://i.redd.it/zri15v9sqfe51.jpg,2020-08-01 18:37:52
i1z3wm,WritingPrompts,whereiswilson,3841,"[WP] The amount of money your soulmate currently has appears over your head. The number over your head has always been low. Then one day, while sitting it your car, it suddenly shoots up and surpasses $1,000,000. Seconds later, someone jumps into your car and yells, “DRIVE!”",self.WritingPrompts,https://www.reddit.com/r/WritingPrompts/comments/i1z3wm/wp_the_amount_of_money_your_soulmate_currently/,2020-08-01 20:26:00
i1wd62,pokemongo,Kostyurik,7592,Am I the only one?,i.redd.it,https://i.redd.it/tt92gywiife51.jpg,2020-08-01 17:51:18
i1u1qf,MovieDetails,abraksis747,23368,X-men First Class (2011) young Erik Lehnsherr is told to move a coin. The 5 Reichsmark coin was usually made of Silver. Silver has a weak magnetic signature. Moving it would be extremely difficult for someone who isn't in control of their powers,imgur.com,https://imgur.com/knWmy8k,2020-08-01 15:31:19
i1uqo3,marvelmemes,Danskerz,14033,This is such a Tom Holland thing,i.redd.it,https://i.redd.it/w5wksjt91fe51.jpg,2020-08-01 16:13:47
i1u0c8,SelfAwarewolves,Valuable_Meringue,18643,"They weren’t just close to the point, they got impaled on it",i.redd.it,https://i.redd.it/3ygf38y9tee51.jpg,2020-08-01 15:28:57
i1zl1t,deadbydaylight,deinterlacing,3593,thanks man I appreciate it,i.redd.it,https://i.redd.it/npzxyk6iege51.png,2020-08-01 20:51:20
i1vw24,politics,oapster79,22239,Private school attended by Barron Trump prohibited from in-person learning until October as President pushes openings,kfor.com,https://kfor.com/news/national/private-school-attended-by-barron-trump-prohibited-from-in-person-learning-until-october-as-president-pushes-openings/,2020-08-01 17:23:33
i1wogy,halo,Neil_jpg,7160,This is a joke so please don't start a argument in the comments.,v.redd.it,https://v.redd.it/2w76nacvlfe51,2020-08-01 18:09:25
i1ufws,TIHI,lol62056,23788,Thanks I hate this Harold mask,i.redd.it,https://i.redd.it/9vtaxkfzxee51.jpg,2020-08-01 15:55:25
i1yxcg,unpopularopinion,hezzyb,5119,"""If you don't have anything nice to say, don't say anything at all"" is why some people can't take constructive criticism",self.unpopularopinion,https://www.reddit.com/r/unpopularopinion/comments/i1yxcg/if_you_dont_have_anything_nice_to_say_dont_say/,2020-08-01 20:17:12
i1z2o2,dankmemes,notkhaos,23855,"Make love, creatures!",i.redd.it,https://i.redd.it/wlfubt8y9ge51.jpg,2020-08-01 20:24:13
i1u998,lifehacks,this_unique_username,13039,Never have your marker stolen again!,i.redd.it,https://i.redd.it/678tw4g39de51.jpg,2020-08-01 15:43:45
i1t1bs,technology,adsman1979,21741,"Another Reminder Cable TV Is Dying: Comcast Lost 477,000 Cable Subscribers Last Quarter",nationalinterest.org,https://nationalinterest.org/blog/techland/another-reminder-cable-tv-dying-comcast-lost-477000-cable-subscribers-last-quarter,2020-08-01 14:26:31
i1vdgu,technicallythetruth,Niyi_M,18522,marine animals,i.redd.it,https://i.redd.it/quof2le78fe51.jpg,2020-08-01 16:52:41
i1xxc2,ChildrenFallingOver,Elephantmenstruation,4329,who needs an amusement park 🥴oHmIgOsH,v.redd.it,https://v.redd.it/320bds3ryfe51,2020-08-01 19:22:36
i1voqe,apexlegends,zejanis,14305,Thats a happy little Caustic trap :),v.redd.it,https://v.redd.it/vuckfk09bfe51,2020-08-01 17:11:09
i1wmca,SmashBrosUltimate,speedowagooooooon,8202,You were the kindest man on this toxic online,i.redd.it,https://i.redd.it/k17zenjalfe51.jpg,2020-08-01 18:06:06
i1ubkg,conspiracy,m0nolith_TitaN,12523,here’s another pic of Clinton on Epstein’s jet for you to delete lol,i.redd.it,https://i.redd.it/5kgvq99lwee51.jpg,2020-08-01 15:47:51
i1xbho,buildapc,Calizonian,4811,Friend scammed me on a PC build,self.buildapc,https://www.reddit.com/r/buildapc/comments/i1xbho/friend_scammed_me_on_a_pc_build/,2020-08-01 18:46:52
i1xkgy,MadeMeSmile,The__Theory,19217,12 years,i.redd.it,https://i.redd.it/83lkwgl7vfe51.jpg,2020-08-01 19:01:35
