id,subreddit,author,score,title,domain,url,created_utc
i2goll,trashy,boomshiki,14723,Id help her pack,i.redd.it,https://i.redd.it/qb9nm7mcrme51.jpg,2020-08-02 18:12:25
i2g36d,nonononoyes,memezzer,16659,I’ll protect you,v.redd.it,https://v.redd.it/xho6vtpclme51,2020-08-02 17:38:57
i2ea25,todayilearned,OrangElm,56144,"TIL that “TurboTax Free” is not actually free, but “TurboTax Free File” actually IS free (if you make under 36k). This was done to purposefully mislead the public into paying for a service that should be free according to the IRS.",theverge.com,https://www.theverge.com/2019/4/26/18518211/turbotax-free-tax-filing-hidden-google-search-results,2020-08-02 15:53:26
i2eyyj,me_irl,Applied_Mathematics,28980,me_irl,i.imgur.com,https://i.imgur.com/DjkT0K7.png,2020-08-02 16:34:30
i2e7a7,FuckYouKaren,Bryles333,33073,No one has time for Karens,i.redd.it,https://i.redd.it/msup7vrq1me51.jpg,2020-08-02 15:48:53
i2ffg2,dataisbeautiful,Gooberchev,12939,My attempt to graphically combat the idea that U.S. has more cases because we test more. [OC],i.redd.it,https://i.redd.it/pk7cd20ieme51.png,2020-08-02 17:01:10
i2drmj,dankmemes,tahzeerr,95860,Fuck Nepotism,i.imgur.com,https://i.imgur.com/JEu4eZS.gifv,2020-08-02 15:22:01
i2fbcv,PublicFreakout,niqdisaster,12476,When your job is to tell people the parks are closed due to Corona (audio on) Austin TX,v.redd.it,https://v.redd.it/md8gvdmbdme51,2020-08-02 16:54:37
i2edpe,funny,yogibaba5491,30921,Best Cooking Show Ever!!,v.redd.it,https://v.redd.it/7qj7szkm3me51,2020-08-02 15:59:42
i2f5iu,interestingasfuck,gargunwich,16480,This tree on my Aunts property has a story to tell.,i.redd.it,https://i.redd.it/pdpqod1rbme51.jpg,2020-08-02 16:44:59
i2fvzn,baseball,lgm225,6317,"[Healey] BREAKING: The Mets don't know where Yoenis Cespedes is. Team statement: ""As of game time, Yoenis Céspedes has not reported to the ballpark today. He did not reach out to management with any explanation for his absence. Our attempts to contact him have been unsuccessful.""",twitter.com,https://twitter.com/timbhealey/status/1289975903502491648?s=21,2020-08-02 17:27:32
i2ddj4,KidsAreFuckingStupid,embrmc,30768,A for effort.,i.redd.it,https://i.redd.it/4zpums4lsle51.jpg,2020-08-02 14:57:36
i2dlsu,ABoringDystopia,xforedk,23742,Anyway...,i.redd.it,https://i.redd.it/athpw622vle51.jpg,2020-08-02 15:11:30
i2ctg3,science,InvictusJoker,23794,"Scientists have discovered if they block PLpro (a viral protein), the SARS-CoV-2 virus production was inhibited and the innate immune response of the human cells was strengthened at the same time.",goethe-university-frankfurt.de,https://www.goethe-university-frankfurt.de/press-releases?year=2020,2020-08-02 14:21:48
i2czdg,gifs,WhenMachinesCry,27149,Ringo Starr photo attempt,gfycat.com,https://gfycat.com/insistentsphericalkawala,2020-08-02 14:32:39
i2e1pn,WatchPeopleDieInside,Kiwi1338,48195,umm... what just happened?,v.redd.it,https://v.redd.it/1cwp4bazzle51,2020-08-02 15:39:27
i2d73y,formula1,LordMcze,24448,[@Mercedes-AMG F1] HQYACQUACYQGABAHWVAKDBXKCOEHAPZHXNCYWKAJJZ,twitter.com,https://twitter.com/MercedesAMGF1/status/1289934431059410950?s=19,2020-08-02 14:46:20
i2fsbs,aww,TheGoldenBoi_,10015,A very fine cheetah,i.redd.it,https://i.redd.it/09886vjaime51.jpg,2020-08-02 17:21:39
i2dk7h,WhatsWrongWithYourDog,e_nathan,13956,My rescue dog trying to bury his doggie ice cream (lactose free) in the bed to save it for later.,v.redd.it,https://v.redd.it/uoyquvcgule51,2020-08-02 15:08:52
i2fjdl,MadeMeSmile,pratiknarola,11340,This clip made my day.,v.redd.it,https://v.redd.it/ns5k98pkfme51,2020-08-02 17:07:32
i2d6s6,agedlikemilk,TaxiDriver10101,20340,Trust Me,i.redd.it,https://i.redd.it/vbr5hbehqle51.jpg,2020-08-02 14:45:48
i2ctmr,memes,tteeggeerr,123688,please enjoy,i.redd.it,https://i.redd.it/rgce12mplle51.jpg,2020-08-02 14:22:10
i2dpgo,Bad_Cop_No_Donut,Enlgoi,11572,Let’s get this going. The media needs to show this stuff we’ve been seeing everywhere but there.,i.redd.it,https://i.redd.it/thoqq8e8wle51.jpg,2020-08-02 15:18:08
i2ckgq,natureismetal,My_Memes_Will_Cure_U,28941,"Largest Elephant in the world, weighing approx 8000 kgs",i.imgur.com,https://i.imgur.com/whNSflo.gifv,2020-08-02 14:04:55
i2fhm8,mildlyinteresting,droo46,7174,This banana painted on the floor of a grocery store.,i.imgur.com,https://i.imgur.com/UvEnnmf.jpg,2020-08-02 17:04:33
i2duqe,movies,RayInRed,8805,"James Hong, he's probably been in more movies than any actor in history",cnn.com,https://www.cnn.com/2020/08/02/entertainment/james-hong-actor-movie-credits-trnd/,2020-08-02 15:27:17
i2d4fi,politics,DaFunkJunkie,68421,It's time to start handing out fines to people who refuse to wear masks,businessinsider.com,https://www.businessinsider.com/fines-needed-people-dont-wear-masks-covid-19-coronavirus-2020-7,2020-08-02 14:41:26
i2cds0,sadcringe,RyanWhittaerFE16,35542,Ahh,i.redd.it,https://i.redd.it/31yrcgozgle51.jpg,2020-08-02 13:52:38
i2dun8,nextfuckinglevel,AdAstra3830,26710,Marilyn Monroe’s Potato Sack Shoot,i.redd.it,https://i.redd.it/j1vwy4uuxle51.jpg,2020-08-02 15:27:07
i2eleb,MurderedByWords,beerbellybegone,15651,"He's a real stand up fella, Tyrone is",i.redd.it,https://i.redd.it/bhz0yuep5me51.jpg,2020-08-02 16:12:02
i2fdu8,gaming,vember_94,9013,I might buy this game just for that tbh,i.redd.it,https://i.redd.it/g3tg5i66eme51.jpg,2020-08-02 16:58:36
i2c6hk,woahdude,danschaubdesigns,24676,"You liked my other mask, figured I should share my more impressive art",i.redd.it,https://i.redd.it/m5juyibcele51.jpg,2020-08-02 13:37:43
i2d9tz,TheLastAirbender,FriendlyChance,16234,"I loved how these soldiers were dumbasses, it really humanized them",i.redd.it,https://i.redd.it/htoiatoerle51.png,2020-08-02 14:51:13
i2cnch,WhitePeopleTwitter,nineinchrain,17664,Spielberg knew more about American people.,i.redd.it,https://i.redd.it/06gxr4n5kle51.jpg,2020-08-02 14:10:22
i2dtfm,UNBGBBIIVCHIDCTIICBG,YanniFromPakistanni,8015,Girl Coming Out Of Her Shell.,v.redd.it,https://v.redd.it/ev1l9smbxle51,2020-08-02 15:25:03
i2cxp9,oddlyterrifying,Ipreferpintrest,18138,"My boyfriend fell asleep making pizza, it cooked for NINE HOURS",i.redd.it,https://i.redd.it/2x8pt7nlnle51.jpg,2020-08-02 14:29:40
i2c9jv,BikiniBottomTwitter,Cany0udance,29712,The site was better when the only option was gold,i.redd.it,https://i.redd.it/f039f5lcfle51.jpg,2020-08-02 13:43:48
i2cq49,therewasanattempt,jasontaken,22433,to attack mom,gfycat.com,https://gfycat.com/smugsnarlinghorseshoecrab-cats,2020-08-02 14:15:32
i2eszg,Wellthatsucks,MKorostoff,7940,Oh no,v.redd.it,https://v.redd.it/rqnqh5pz7me51,2020-08-02 16:24:31
i2ec69,Eyebleach,are_you_angrish,10592,"For all of you sorting by new, here’s a goose of mine",i.redd.it,https://i.redd.it/g22aaml63me51.jpg,2020-08-02 15:57:01
i2cfim,pics,Astreeter12,57229,How it feels to be a healthcare worker right now,i.redd.it,https://i.redd.it/3bvubjklhle51.jpg,2020-08-02 13:55:59
i2clsy,maybemaybemaybe,My_Memes_Will_Cure_U,20118,Maybe maybe maybe,i.imgur.com,https://i.imgur.com/mXEJHIf.gifv,2020-08-02 14:07:32
i2djcg,youseeingthisshit,amy2kim22,11993,Test to see if it's real,v.redd.it,https://v.redd.it/1w9xb089ule51,2020-08-02 15:07:23
i2ecv9,blursedimages,ThatOneGamer713,18985,Blursed Jenner,i.redd.it,https://i.redd.it/onod89xe3me51.jpg,2020-08-02 15:58:15
i2etms,EarthPorn,blaabear,5886,"Have been on holiday in my own country this year. This is Nærøyfjorden in Norway, looks almost like an old oil painting. OC [2945 x 3912]",i.redd.it,https://i.redd.it/bfi3qona8me51.jpg,2020-08-02 16:25:38
i2cwit,blackmagicfuckery,BlazingSpear,20202,Up is down and down is up,v.redd.it,https://v.redd.it/bo863p9umle51,2020-08-02 14:27:27
i2egxo,whitepeoplegifs,9999monkeys,5713,The faster way down,gfycat.com,https://gfycat.com/powerlessrewardingirishredandwhitesetter,2020-08-02 16:04:37
i2eh5h,cursedcomments,ScaredyDragon,20685,Cursed Superman,i.redd.it,https://i.redd.it/lwfdzy6m4me51.jpg,2020-08-02 16:04:59
i2bszm,AnimalsBeingBros,Scullkrush,26703,Sharing is caring,v.redd.it,https://v.redd.it/qzvs2oqf9le51,2020-08-02 13:10:18
i2d5et,PrequelMemes,AnakinSkyguyWalker,23272,I need a Kenobi plush,i.redd.it,https://i.redd.it/oxmxmmf1qle51.jpg,2020-08-02 14:43:17
i2e7fz,wholesomememes,pretransitionmtf44,16070,Felt like this would fit here,i.redd.it,https://i.redd.it/kcf08oms1me51.jpg,2020-08-02 15:49:11
i2cprd,ShitPostCrusaders,FunnyValentineMP4,27735,JoJo's Bizarre Twitter Thread Continues,i.redd.it,https://i.redd.it/i0u947zxkle51.jpg,2020-08-02 14:14:52
i2b710,LeopardsAteMyFace,xbhaskarx,27228,Congressman Louie Gohmert’s (R-TX) daughter: “It’s not worth following a President who has no remorse for leading his followers to an early grave.”,i.imgur.com,https://i.imgur.com/BPb8iwd.jpg,2020-08-02 12:22:45
i2cwy5,Instagramreality,PlasticSunMap,9547,the woman in the picture often posts about how people use angles to appear skinnier and to hide cellulite/skin blemishes - found on her instagram,i.redd.it,https://i.redd.it/cgw58nrcnle51.jpg,2020-08-02 14:28:16
i2budu,LateStageCapitalism,kevinowdziej,12547,Sounds heroic,i.redd.it,https://i.redd.it/edw6e8uy9le51.jpg,2020-08-02 13:13:12
i2c9gc,menwritingwomen,tronixmastermind,13520,Wildin out at DnD lol,i.redd.it,https://i.redd.it/bnd2kerdfle51.jpg,2020-08-02 13:43:33
i2fdg2,suspiciouslyspecific,dont-judge-KrYpTiC,6409,Dominoes,i.redd.it,https://i.redd.it/bintfxb2eme51.jpg,2020-08-02 16:57:57
i2fxv8,JusticeServed,Majnum,3868,Woman gets prison sentence for having dogs attack Akron grocery store worker,cleveland.com,https://www.cleveland.com/court-justice/2020/07/woman-gets-prison-sentence-for-having-dogs-attack-akron-grocery-store-worker.html,2020-08-02 17:30:37
i2cbak,facepalm,wait_whats_illegal,57253,Hold up (found on twitter with #maga tag),i.imgur.com,https://i.imgur.com/Sb8QNXp.jpg,2020-08-02 13:47:32
i2bmsa,tifu,that_filming_guy,32313,TIFU by Becoming a Suspected Pedophile,self.tifu,https://www.reddit.com/r/tifu/comments/i2bmsa/tifu_by_becoming_a_suspected_pedophile/,2020-08-02 12:57:35
i2g9p0,BlackPeopleTwitter,AmiBorg,3924,Available now in Technicolor from all national broadcasters,i.redd.it,https://i.redd.it/atrxg3kkmme51.png,2020-08-02 17:49:20
i2b8gf,insanepeoplefacebook,Active-Ad-233,48008,Couldn't be more convincing,i.redd.it,https://i.redd.it/fmkweb1g1le51.jpg,2020-08-02 12:25:55
i2bif9,HistoryPorn,Paul-Belgium,14053,"What is now the fully developed Las Vegas strip, 1955. [494 x 492]",i.redd.it,https://i.redd.it/mvmip6gk5le51.jpg,2020-08-02 12:48:33
i2bpdc,Whatcouldgowrong,micnoo,24446,Kid stands in the middle of a bike ramp,v.redd.it,https://v.redd.it/7jus39hbahe51,2020-08-02 13:02:55
i2b4fv,NintendoSwitch,Zarski843,37078,Nintendo is really missing a huge opportunity by not porting Gamecube games over to Switch.,self.NintendoSwitch,https://www.reddit.com/r/NintendoSwitch/comments/i2b4fv/nintendo_is_really_missing_a_huge_opportunity_by/,2020-08-02 12:16:38
i2bcg6,ScottishPeopleTwitter,CookieBitDBC,18012,constant struggle,i.redd.it,https://i.redd.it/38ulxxn53le51.png,2020-08-02 12:35:04
i2bfei,oddlysatisfying,wheelybindealer,25297,Awesome Carpentry,v.redd.it,https://v.redd.it/krk4w40w8je51,2020-08-02 12:41:36
i2fs0w,insaneparents,DessieDearest,5545,Doesn't think using a belt to cause welts is abuse if it's their own kid,i.redd.it,https://i.redd.it/yhmz05z7ime51.png,2020-08-02 17:21:15
i2b3rv,worldnews,hildebrand_rarity,75382,Americans Go Home: Canadians Track U.S. Boaters Sneaking Across The Border,npr.org,https://www.npr.org/2020/08/02/898165324/americans-go-home-canadians-track-u-s-boaters-sneaking-across-the-border?utm_medium=RSS&amp;utm_campaign=news,2020-08-02 12:15:12
i2anbq,assholedesign,Iescaunare,62870,Amazon Prime Video doesn't tell you if a show is unavailable in your country until after you subscribe to Amazon Prime.,i.redd.it,https://i.redd.it/y5gxwuz3ske51.png,2020-08-02 11:34:13
i2c7ra,Showerthoughts,EmptyStupidity,18572,"Cleaning the whole house is a great way to feel productive, while procrastinating important stuff",self.Showerthoughts,https://www.reddit.com/r/Showerthoughts/comments/i2c7ra/cleaning_the_whole_house_is_a_great_way_to_feel/,2020-08-02 13:40:17
i2b05t,PoliticalHumor,MarxReadsRushdie,48737,"Imagine, if you will, an asshole",i.redd.it,https://i.redd.it/2wzzco52yke51.jpg,2020-08-02 12:06:28
i2cpto,AnimalCrossing,camyjii,11712,When you just trying to do something romantic with your boyfriend during firework festival...,v.redd.it,https://v.redd.it/7bqefi5pkle51,2020-08-02 14:14:59
i2br8e,whatisthisthing,StpdF0x,13507,"This strange lightbulb i got at a thrift store. It gives off a strange sporadic glimmer when plugged in, it might just be broken.",gfycat.com,https://gfycat.com/graylivelygypsymoth,2020-08-02 13:06:37
i2c22m,UpliftingNews,speckz,9178,"Wyoming’s ‘Bird Lady’ offers a haven for injured birds - For the past 33 years, Susan Ahalt has run one of the only bird rehabilitation facilities in the state.",hcn.org,https://www.hcn.org/articles/birds-wyomings-bird-lady-offers-a-haven-for-injured-birds,2020-08-02 13:29:06
i2d8pf,PoliticalCompassMemes,19494,8782,political compass but it's babylon bee.,i.redd.it,https://i.redd.it/q79kor7zqle51.png,2020-08-02 14:49:16
i2h7zu,aww,OnderHund,6904,It’s dangerous to go alone! Take this with you.,i.redd.it,https://i.redd.it/yk9jgsqww9e31.jpg,2020-08-02 18:42:25
i2dwep,leagueoflegends,Yourstruly777,5372,Old man reaches plat after 7 years of trying,self.leagueoflegends,https://www.reddit.com/r/leagueoflegends/comments/i2dwep/old_man_reaches_plat_after_7_years_of_trying/,2020-08-02 15:30:23
i2awad,news,Wise_Collection,28887,Egypt tells Musk pyramids were not built by aliens,bbc.com,https://www.bbc.com/news/world-africa-53627888,2020-08-02 11:57:15
i2b4ba,nottheonion,hildebrand_rarity,16774,Americans Go Home: Canadians Track U.S. Boaters Sneaking Across The Border,npr.org,https://www.npr.org/2020/08/02/898165324/americans-go-home-canadians-track-u-s-boaters-sneaking-across-the-border,2020-08-02 12:16:23
i2ci77,Art,cosmiccraphounder,9188,"Chiron the Centaur, Me, gouache on paper, 2020",i.redd.it,https://i.redd.it/j2vz225cile51.jpg,2020-08-02 14:00:56
i2cnmg,ProgrammerHumor,haddock420,7608,Even the experts don't know everything,i.imgur.com,https://i.imgur.com/JOAwTzW.png,2020-08-02 14:10:58
i2djq8,MemeEconomy,stabbler53,7193,Invest huge potential.,i.redd.it,https://i.redd.it/vhfa1lkgule51.jpg,2020-08-02 15:08:04
i2bx5n,formuladank,faemsa,12011,Mercedes 1-2 confirmed… :(,i.redd.it,https://i.redd.it/z3x5ifx0ble51.jpg,2020-08-02 13:19:08
i2au1o,TIHI,AristonD,37247,"Thanks, I hate chicken feet socks.",i.redd.it,https://i.redd.it/jugr869evke51.jpg,2020-08-02 11:51:31
i2am87,awfuleverything,agentzuko,55154,The fact that this is so common is heartbreaking,i.redd.it,https://i.redd.it/0z8hqb4vrke51.jpg,2020-08-02 11:31:44
i2b80f,dndmemes,DungeonsWithFriends,19207,All That AC And Nothing To Do With It.,i.redd.it,https://i.redd.it/s09nqnbd1le51.jpg,2020-08-02 12:25:01
i2fsfl,instantkarma,Jvenz,4435,Instant karma,v.redd.it,https://v.redd.it/g1p11zzwnje51,2020-08-02 17:21:51
i2az5a,HumansBeingBros,mulmer96,25263,Passed by this laying on the street outside during a walk,i.redd.it,https://i.redd.it/2b6gzacnxke51.jpg,2020-08-02 12:04:10
i2be3z,AskReddit,TTVKrooked,28555,What is the worst notification you have received whilst someone else has had your phone?,self.AskReddit,https://www.reddit.com/r/AskReddit/comments/i2be3z/what_is_the_worst_notification_you_have_received/,2020-08-02 12:38:37
i2ar5p,videos,ASparrowe,25155,"My 30y/o mate started skateboarding a few months ago, today he landed his first kickflip, he posts videos for his close friends but i'm so proud i had to share.",youtube.com,https://www.youtube.com/watch?v=tNIoyBoHcL4&amp;t=0s,2020-08-02 11:43:57
i2bi76,fightporn,SpiceBoi20,13902,Definitely not that guy's day,v.redd.it,https://v.redd.it/wfkhe98e5le51,2020-08-02 12:48:02
i2buk0,hmmm,sidshembekar,13486,hmmm,i.redd.it,https://i.redd.it/0etgfmr0ale51.jpg,2020-08-02 13:13:33
i2dygo,OTMemes,DGH1993,6627,He technically is,i.redd.it,https://i.redd.it/3l2reyl1zle51.jpg,2020-08-02 15:33:47
i2gomk,memes,Master_Flip,24607,Who knows why?,i.redd.it,https://i.redd.it/8l82z1uarme51.png,2020-08-02 18:12:28
i2c6o0,rarepuppers,JaimeAMendez,10398,Still Working On His Blue Steel,i.redd.it,https://i.redd.it/uhkqdwqeele51.jpg,2020-08-02 13:38:06
i2aaa7,NatureIsFuckingLit,zaynthelegend,44571,"🔥 Beehive, Honey and Sunlight.",i.redd.it,https://i.redd.it/t7mi0s4gmke51.jpg,2020-08-02 11:01:36
i2gb53,holdmyredbull,OnlyPostInThisSub,2893,Doesn't Look Good For The Snake!,v.redd.it,https://v.redd.it/0v0qv8kenme51,2020-08-02 17:51:43
i2aujr,Unexpected,desire9me,32896,How to eat?,v.redd.it,https://v.redd.it/xfirdhdlvke51,2020-08-02 11:52:50
i2eqwe,nextfuckinglevel,hriyspungur,16678,Guy uses candles to create an optical illusion,gfycat.com,https://gfycat.com/optimisticanxiouskittiwake,2020-08-02 16:21:09
