id,subreddit,author,score,title,domain,url,created_utc
i2ea25,todayilearned,OrangElm,36867,"TIL that “TurboTax Free” is not actually free, but “TurboTax Free File” actually IS free (if you make under 36k). This was done to purposefully mislead the public into paying for a service that should be free according to the IRS.",theverge.com,https://www.theverge.com/2019/4/26/18518211/turbotax-free-tax-filing-hidden-google-search-results,2020-08-02 15:53:26
i2drmj,dankmemes,tahzeerr,72383,Fuck Nepotism,i.imgur.com,https://i.imgur.com/JEu4eZS.gifv,2020-08-02 15:22:01
i2e7a7,FuckYouKaren,Bryles333,19253,No one has time for Karens,i.redd.it,https://i.redd.it/msup7vrq1me51.jpg,2020-08-02 15:48:53
i2ctg3,science,InvictusJoker,17973,"Scientists have discovered if they block PLpro (a viral protein), the SARS-CoV-2 virus production was inhibited and the innate immune response of the human cells was strengthened at the same time.",goethe-university-frankfurt.de,https://www.goethe-university-frankfurt.de/press-releases?year=2020,2020-08-02 14:21:48
i2dlsu,ABoringDystopia,xforedk,16410,Anyway...,i.redd.it,https://i.redd.it/athpw622vle51.jpg,2020-08-02 15:11:30
i2czdg,gifs,WhenMachinesCry,20128,Ringo Starr photo attempt,gfycat.com,https://gfycat.com/insistentsphericalkawala,2020-08-02 14:32:39
i2d73y,formula1,LordMcze,23270,[@Mercedes-AMG F1] HQYACQUACYQGABAHWVAKDBXKCOEHAPZHXNCYWKAJJZ,twitter.com,https://twitter.com/MercedesAMGF1/status/1289934431059410950?s=19,2020-08-02 14:46:20
i2ddj4,KidsAreFuckingStupid,embrmc,22013,A for effort.,i.redd.it,https://i.redd.it/4zpums4lsle51.jpg,2020-08-02 14:57:36
i2edpe,funny,yogibaba5491,14778,Best Cooking Show Ever!!,v.redd.it,https://v.redd.it/7qj7szkm3me51,2020-08-02 15:59:42
i2e1pn,WatchPeopleDieInside,Kiwi1338,33166,umm... what just happened?,v.redd.it,https://v.redd.it/1cwp4bazzle51,2020-08-02 15:39:27
i2fxeb,Unexpected,desiredcapabilities,9813,Never let anyone know your next move.,v.redd.it,https://v.redd.it/rhcqb68ljme51,2020-08-02 17:29:56
i2ctmr,memes,tteeggeerr,102081,please enjoy,i.redd.it,https://i.redd.it/rgce12mplle51.jpg,2020-08-02 14:22:10
i2d4fi,politics,DaFunkJunkie,59826,It's time to start handing out fines to people who refuse to wear masks,businessinsider.com,https://www.businessinsider.com/fines-needed-people-dont-wear-masks-covid-19-coronavirus-2020-7,2020-08-02 14:41:26
i2eyyj,me_irl,Applied_Mathematics,11636,me_irl,i.imgur.com,https://i.imgur.com/DjkT0K7.png,2020-08-02 16:34:30
i2d6s6,agedlikemilk,TaxiDriver10101,16145,Trust Me,i.redd.it,https://i.redd.it/vbr5hbehqle51.jpg,2020-08-02 14:45:48
i2ckgq,natureismetal,My_Memes_Will_Cure_U,23741,"Largest Elephant in the world, weighing approx 8000 kgs",i.imgur.com,https://i.imgur.com/whNSflo.gifv,2020-08-02 14:04:55
i2cds0,sadcringe,RyanWhittaerFE16,31450,Ahh,i.redd.it,https://i.redd.it/31yrcgozgle51.jpg,2020-08-02 13:52:38
i2c2wx,BlackPeopleTwitter,Skyccord,49753,Harsh realities,i.redd.it,https://i.redd.it/wpk6cr15dle51.png,2020-08-02 13:30:59
i2cfim,pics,Astreeter12,44733,How it feels to be a healthcare worker right now,i.redd.it,https://i.redd.it/3bvubjklhle51.jpg,2020-08-02 13:55:59
i2g36d,nonononoyes,memezzer,5435,I’ll protect you,v.redd.it,https://v.redd.it/xho6vtpclme51,2020-08-02 17:38:57
i2c6hk,woahdude,danschaubdesigns,22101,"You liked my other mask, figured I should share my more impressive art",i.redd.it,https://i.redd.it/m5juyibcele51.jpg,2020-08-02 13:37:43
i2bo3t,interestingasfuck,sarahjewel,126868,"Here are my removed &amp; genetically modified white blood cells, about to be put back in to hopefully cure my cancer! This is t-cell immunotherapy!",i.redd.it,https://i.redd.it/g1gln8xo7le51.jpg,2020-08-02 13:00:28
i2fvzn,baseball,lgm225,4464,"[Healey] BREAKING: The Mets don't know where Yoenis Cespedes is. Team statement: ""As of game time, Yoenis Céspedes has not reported to the ballpark today. He did not reach out to management with any explanation for his absence. Our attempts to contact him have been unsuccessful.""",twitter.com,https://twitter.com/timbhealey/status/1289975903502491648?s=21,2020-08-02 17:27:32
i2dk7h,WhatsWrongWithYourDog,e_nathan,9190,My rescue dog trying to bury his doggie ice cream (lactose free) in the bed to save it for later.,v.redd.it,https://v.redd.it/uoyquvcgule51,2020-08-02 15:08:52
i2c9jv,BikiniBottomTwitter,Cany0udance,24717,The site was better when the only option was gold,i.redd.it,https://i.redd.it/f039f5lcfle51.jpg,2020-08-02 13:43:48
i2eleb,MurderedByWords,beerbellybegone,10602,"He's a real stand up fella, Tyrone is",i.redd.it,https://i.redd.it/bhz0yuep5me51.jpg,2020-08-02 16:12:02
i2dpgo,Bad_Cop_No_Donut,Enlgoi,7435,Let’s get this going. The media needs to show this stuff we’ve been seeing everywhere but there.,i.redd.it,https://i.redd.it/thoqq8e8wle51.jpg,2020-08-02 15:18:08
i2cig3,BrandNewSentence,oldatlas,14400,long neck boi,i.redd.it,https://i.redd.it/m2anb1hkile51.jpg,2020-08-02 14:01:25
i2cq49,therewasanattempt,jasontaken,17714,to attack mom,gfycat.com,https://gfycat.com/smugsnarlinghorseshoecrab-cats,2020-08-02 14:15:32
i2clsy,maybemaybemaybe,My_Memes_Will_Cure_U,16592,Maybe maybe maybe,i.imgur.com,https://i.imgur.com/mXEJHIf.gifv,2020-08-02 14:07:32
i2cxp9,oddlyterrifying,Ipreferpintrest,13760,"My boyfriend fell asleep making pizza, it cooked for NINE HOURS",i.redd.it,https://i.redd.it/2x8pt7nlnle51.jpg,2020-08-02 14:29:40
i2bszm,AnimalsBeingBros,Scullkrush,23412,Sharing is caring,v.redd.it,https://v.redd.it/qzvs2oqf9le51,2020-08-02 13:10:18
i2b710,LeopardsAteMyFace,xbhaskarx,24992,Congressman Louie Gohmert’s (R-TX) daughter: “It’s not worth following a President who has no remorse for leading his followers to an early grave.”,i.imgur.com,https://i.imgur.com/BPb8iwd.jpg,2020-08-02 12:22:45
i2cbak,facepalm,wait_whats_illegal,50418,Hold up (found on twitter with #maga tag),i.imgur.com,https://i.imgur.com/Sb8QNXp.jpg,2020-08-02 13:47:32
i2cwit,blackmagicfuckery,BlazingSpear,15748,Up is down and down is up,v.redd.it,https://v.redd.it/bo863p9umle51,2020-08-02 14:27:27
i2d9tz,TheLastAirbender,FriendlyChance,11032,"I loved how these soldiers were dumbasses, it really humanized them",i.redd.it,https://i.redd.it/htoiatoerle51.png,2020-08-02 14:51:13
i2dtfm,UNBGBBIIVCHIDCTIICBG,YanniFromPakistanni,6019,Girl Coming Out Of Her Shell.,v.redd.it,https://v.redd.it/ev1l9smbxle51,2020-08-02 15:25:03
i2ffg2,dataisbeautiful,Gooberchev,4736,My attempt to graphically combat the idea that U.S. has more cases because we test more. [OC],i.redd.it,https://i.redd.it/pk7cd20ieme51.png,2020-08-02 17:01:10
i2cprd,ShitPostCrusaders,FunnyValentineMP4,23714,JoJo's Bizarre Twitter Thread Continues,i.redd.it,https://i.redd.it/i0u947zxkle51.jpg,2020-08-02 14:14:52
i2bmsa,tifu,that_filming_guy,28805,TIFU by Becoming a Suspected Pedophile,self.tifu,https://www.reddit.com/r/tifu/comments/i2bmsa/tifu_by_becoming_a_suspected_pedophile/,2020-08-02 12:57:35
i2b8gf,insanepeoplefacebook,Active-Ad-233,43473,Couldn't be more convincing,i.redd.it,https://i.redd.it/fmkweb1g1le51.jpg,2020-08-02 12:25:55
i2b4fv,NintendoSwitch,Zarski843,33469,Nintendo is really missing a huge opportunity by not porting Gamecube games over to Switch.,self.NintendoSwitch,https://www.reddit.com/r/NintendoSwitch/comments/i2b4fv/nintendo_is_really_missing_a_huge_opportunity_by/,2020-08-02 12:16:38
i2b3rv,worldnews,hildebrand_rarity,69294,Americans Go Home: Canadians Track U.S. Boaters Sneaking Across The Border,npr.org,https://www.npr.org/2020/08/02/898165324/americans-go-home-canadians-track-u-s-boaters-sneaking-across-the-border?utm_medium=RSS&amp;utm_campaign=news,2020-08-02 12:15:12
i2c9gc,menwritingwomen,tronixmastermind,11492,Wildin out at DnD lol,i.redd.it,https://i.redd.it/bnd2kerdfle51.jpg,2020-08-02 13:43:33
i2budu,LateStageCapitalism,kevinowdziej,10515,Sounds heroic,i.redd.it,https://i.redd.it/edw6e8uy9le51.jpg,2020-08-02 13:13:12
i2b3mg,PublicFreakout,Ghulam_Jewel,66996,Meeting up with your best friend after a long time,v.redd.it,https://v.redd.it/bk3osryhzke51,2020-08-02 12:14:51
i2anbq,assholedesign,Iescaunare,58528,Amazon Prime Video doesn't tell you if a show is unavailable in your country until after you subscribe to Amazon Prime.,i.redd.it,https://i.redd.it/y5gxwuz3ske51.png,2020-08-02 11:34:13
i2b05t,PoliticalHumor,MarxReadsRushdie,45174,"Imagine, if you will, an asshole",i.redd.it,https://i.redd.it/2wzzco52yke51.jpg,2020-08-02 12:06:28
i2b6rf,aww,BobRossTheBoss2,39702,Decided that I should celebrate my cake day by getting a new puppy.,i.redd.it,https://i.redd.it/sjdwrgmu0le51.jpg,2020-08-02 12:22:07
i2bcg6,ScottishPeopleTwitter,CookieBitDBC,15944,constant struggle,i.redd.it,https://i.redd.it/38ulxxn53le51.png,2020-08-02 12:35:04
i2el5c,GetMotivated,alfaguara27,4856,[Image] You’re Not Finished,i.redd.it,https://i.redd.it/srjiipms5me51.jpg,2020-08-02 16:11:36
i2dtno,MadeMeSmile,D0NW0N,10850,I couldn’t imagine,i.redd.it,https://i.redd.it/sc9cm7tjxle51.jpg,2020-08-02 15:25:23
i2bif9,HistoryPorn,Paul-Belgium,12008,"What is now the fully developed Las Vegas strip, 1955. [494 x 492]",i.redd.it,https://i.redd.it/mvmip6gk5le51.jpg,2020-08-02 12:48:33
i2awad,news,Wise_Collection,24368,Egypt tells Musk pyramids were not built by aliens,bbc.com,https://www.bbc.com/news/world-africa-53627888,2020-08-02 11:57:15
i2bfei,oddlysatisfying,wheelybindealer,20264,Awesome Carpentry,v.redd.it,https://v.redd.it/krk4w40w8je51,2020-08-02 12:41:36
i2d5et,PrequelMemes,AnakinSkyguyWalker,16059,I need a Kenobi plush,i.redd.it,https://i.redd.it/oxmxmmf1qle51.jpg,2020-08-02 14:43:17
i2cwy5,Instagramreality,PlasticSunMap,7355,the woman in the picture often posts about how people use angles to appear skinnier and to hide cellulite/skin blemishes - found on her instagram,i.redd.it,https://i.redd.it/cgw58nrcnle51.jpg,2020-08-02 14:28:16
i2bpdc,Whatcouldgowrong,micnoo,19226,Kid stands in the middle of a bike ramp,v.redd.it,https://v.redd.it/7jus39hbahe51,2020-08-02 13:02:55
i2ancl,nextfuckinglevel,NiceCasualRedditGuy,77232,What it's like to drive in a Seabreacher,v.redd.it,https://v.redd.it/6c6nhzf7ske51,2020-08-02 11:34:17
i2br8e,whatisthisthing,StpdF0x,11873,"This strange lightbulb i got at a thrift store. It gives off a strange sporadic glimmer when plugged in, it might just be broken.",gfycat.com,https://gfycat.com/graylivelygypsymoth,2020-08-02 13:06:37
i2djcg,youseeingthisshit,amy2kim22,7167,Test to see if it's real,v.redd.it,https://v.redd.it/1w9xb089ule51,2020-08-02 15:07:23
i2am87,awfuleverything,agentzuko,50172,The fact that this is so common is heartbreaking,i.redd.it,https://i.redd.it/0z8hqb4vrke51.jpg,2020-08-02 11:31:44
i2b4ba,nottheonion,hildebrand_rarity,14266,Americans Go Home: Canadians Track U.S. Boaters Sneaking Across The Border,npr.org,https://www.npr.org/2020/08/02/898165324/americans-go-home-canadians-track-u-s-boaters-sneaking-across-the-border,2020-08-02 12:16:23
i2au1o,TIHI,AristonD,33985,"Thanks, I hate chicken feet socks.",i.redd.it,https://i.redd.it/jugr869evke51.jpg,2020-08-02 11:51:31
i2bx5n,formuladank,faemsa,10899,Mercedes 1-2 confirmed… :(,i.redd.it,https://i.redd.it/z3x5ifx0ble51.jpg,2020-08-02 13:19:08
i2ar5p,videos,ASparrowe,23345,"My 30y/o mate started skateboarding a few months ago, today he landed his first kickflip, he posts videos for his close friends but i'm so proud i had to share.",youtube.com,https://www.youtube.com/watch?v=tNIoyBoHcL4&amp;t=0s,2020-08-02 11:43:57
i2ecv9,blursedimages,ThatOneGamer713,10755,Blursed Jenner,i.redd.it,https://i.redd.it/onod89xe3me51.jpg,2020-08-02 15:58:15
i2duqe,movies,RayInRed,4859,"James Hong, he's probably been in more movies than any actor in history",cnn.com,https://www.cnn.com/2020/08/02/entertainment/james-hong-actor-movie-credits-trnd/,2020-08-02 15:27:17
i2az5a,HumansBeingBros,mulmer96,23044,Passed by this laying on the street outside during a walk,i.redd.it,https://i.redd.it/2b6gzacnxke51.jpg,2020-08-02 12:04:10
i2b80f,dndmemes,DungeonsWithFriends,17273,All That AC And Nothing To Do With It.,i.redd.it,https://i.redd.it/s09nqnbd1le51.jpg,2020-08-02 12:25:01
i2aaa7,NatureIsFuckingLit,zaynthelegend,41254,"🔥 Beehive, Honey and Sunlight.",i.redd.it,https://i.redd.it/t7mi0s4gmke51.jpg,2020-08-02 11:01:36
i2eh5h,cursedcomments,ScaredyDragon,11110,Cursed Superman,i.redd.it,https://i.redd.it/lwfdzy6m4me51.jpg,2020-08-02 16:04:59
i2c22m,UpliftingNews,speckz,7288,"Wyoming’s ‘Bird Lady’ offers a haven for injured birds - For the past 33 years, Susan Ahalt has run one of the only bird rehabilitation facilities in the state.",hcn.org,https://www.hcn.org/articles/birds-wyomings-bird-lady-offers-a-haven-for-injured-birds,2020-08-02 13:29:06
i2bi76,fightporn,SpiceBoi20,12067,Definitely not that guy's day,v.redd.it,https://v.redd.it/wfkhe98e5le51,2020-08-02 12:48:02
i2byj1,todayilearned,jamescookenotthatone,26006,"TIL The Offspring's Album 'Smash' had a small budget of $20,000, which limited studio time, the last four songs recorded for the album were worked through in just two nights. 'Smash' went on to be the best-selling album released by an independent record label with over 11 million sales.",en.wikipedia.org,https://en.wikipedia.org/wiki/Smash_(The_Offspring_album),2020-08-02 13:21:48
i2egxo,whitepeoplegifs,9999monkeys,3929,The faster way down,gfycat.com,https://gfycat.com/powerlessrewardingirishredandwhitesetter,2020-08-02 16:04:37
i2buk0,hmmm,sidshembekar,11294,hmmm,i.redd.it,https://i.redd.it/0etgfmr0ale51.jpg,2020-08-02 13:13:33
i2ayhi,greentext,ericliu04,20142,Anon gets a hotdog,i.redd.it,https://i.redd.it/lme1h3ocxke51.jpg,2020-08-02 12:02:30
i2akyn,AnimalCrossing,FunkyOperations,23184,"God Lionel, same.",i.redd.it,https://i.redd.it/ajpppsabrke51.jpg,2020-08-02 11:28:40
i2a6g8,WhitePeopleTwitter,zaynthelegend,40852,lol,i.redd.it,https://i.redd.it/lz5upbjmkke51.jpg,2020-08-02 10:51:18
i2e7fz,wholesomememes,pretransitionmtf44,8440,Felt like this would fit here,i.redd.it,https://i.redd.it/kcf08oms1me51.jpg,2020-08-02 15:49:11
i2c7ra,Showerthoughts,EmptyStupidity,11792,"Cleaning the whole house is a great way to feel productive, while procrastinating important stuff",self.Showerthoughts,https://www.reddit.com/r/Showerthoughts/comments/i2c7ra/cleaning_the_whole_house_is_a_great_way_to_feel/,2020-08-02 13:40:17
i2djq8,MemeEconomy,stabbler53,5606,Invest huge potential.,i.redd.it,https://i.redd.it/vhfa1lkgule51.jpg,2020-08-02 15:08:04
i2ec69,Eyebleach,are_you_angrish,5151,"For all of you sorting by new, here’s a goose of mine",i.redd.it,https://i.redd.it/g22aaml63me51.jpg,2020-08-02 15:57:01
i2be3z,AskReddit,TTVKrooked,19248,What is the worst notification you have received whilst someone else has had your phone?,self.AskReddit,https://www.reddit.com/r/AskReddit/comments/i2be3z/what_is_the_worst_notification_you_have_received/,2020-08-02 12:38:37
i2cmjb,Rainbow6,LeaveHeat,11668,"Doc, on the subject of teammates [Voiceover + animation]",v.redd.it,https://v.redd.it/3b5ti5srjle51,2020-08-02 14:08:50
i2aali,starterpacks,thestreetlife,33153,The 'you haven't lived til you've backpacked through South-East Asia' starter pack,i.redd.it,https://i.redd.it/ecz6v9ximke51.png,2020-08-02 11:02:17
i2a77n,AnimalsBeingDerps,Max2713ger,35239,The perfect pillow doesn't exi-,i.redd.it,https://i.redd.it/zwmf68h0lke51.jpg,2020-08-02 10:53:20
i2c6o0,rarepuppers,JaimeAMendez,8464,Still Working On His Blue Steel,i.redd.it,https://i.redd.it/uhkqdwqeele51.jpg,2020-08-02 13:38:06
i2ci77,Art,cosmiccraphounder,6725,"Chiron the Centaur, Me, gouache on paper, 2020",i.redd.it,https://i.redd.it/j2vz225cile51.jpg,2020-08-02 14:00:56
i2atzg,skyrim,WbtoOfficial,15922,Now this is what I call art,i.redd.it,https://i.redd.it/24s8yo9dvke51.jpg,2020-08-02 11:51:22
i2cxu3,SmashBrosUltimate,AyKayRay,7264,And G&amp;W too Ig,i.redd.it,https://i.redd.it/pmh7l8knnle51.jpg,2020-08-02 14:29:56
i29vyq,coolguides,PigsFlyOnMars,32991,How much musicians make from streams,i.redd.it,https://i.redd.it/gvzcljbcfke51.jpg,2020-08-02 10:21:33
i2aisb,DunderMifflin,IVAN2CRY,18611,This was the biggest plot twist in cinema history.,i.redd.it,https://i.redd.it/wuezoexaqke51.jpg,2020-08-02 11:23:02
i2ai2q,DidntKnowIWantedThat,wheelybindealer,17161,Awesome Carpentry,v.redd.it,https://v.redd.it/krk4w40w8je51,2020-08-02 11:21:12
i2azss,food,MaxRamsey,10219,"[Homemade] Blueberry, nectarine and strawberry smoothie, blended with coconut milk, honey and ground cinnamon.",i.redd.it,https://i.redd.it/s1sdqyqwxke51.jpg,2020-08-02 12:05:37
i2c8ns,AvatarMemes,PsychologicalSpot0,8035,The boys together are like my last two brain cells during a test,i.redd.it,https://i.redd.it/jwa5nfr3fle51.jpg,2020-08-02 13:42:01
i2azla,Minecraft,069420,41501,Slime Volleyball,v.redd.it,https://v.redd.it/o2lgy51rxke51,2020-08-02 12:05:09
i2d521,formula1,magony,8328,Hamilton wins the British GP with a blown tire!,streamable.com,https://streamable.com/yjf1d9,2020-08-02 14:42:37
i2ak7y,tumblr,Tagginga,17116,Technically the truth but damn,i.imgur.com,https://i.imgur.com/DsDpZ7M.jpg,2020-08-02 11:26:41
