id,subreddit,author,score,title,domain,url,created_utc
i2dzgb,aww,PM-ME-YOUR-CUTE-SOCK,35234,Astronaut Leland Melvin's official NASA portrait,i.redd.it,https://i.redd.it/rm1z8449u0e31.jpg,2020-08-02 15:35:29
i2d4fi,politics,DaFunkJunkie,45022,It's time to start handing out fines to people who refuse to wear masks,businessinsider.com,https://www.businessinsider.com/fines-needed-people-dont-wear-masks-covid-19-coronavirus-2020-7,2020-08-02 14:41:26
i2d73y,formula1,LordMcze,20535,[@Mercedes-AMG F1] HQYACQUACYQGABAHWVAKDBXKCOEHAPZHXNCYWKAJJZ,twitter.com,https://twitter.com/MercedesAMGF1/status/1289934431059410950?s=19,2020-08-02 14:46:20
i2drmj,dankmemes,tahzeerr,29344,Fuck Nepotism,i.imgur.com,https://i.imgur.com/JEu4eZS.gifv,2020-08-02 15:22:01
i2c2wx,BlackPeopleTwitter,Skyccord,38140,Harsh realities,i.redd.it,https://i.redd.it/wpk6cr15dle51.png,2020-08-02 13:30:59
i2cds0,sadcringe,RyanWhittaerFE16,23307,Ahh,i.redd.it,https://i.redd.it/31yrcgozgle51.jpg,2020-08-02 13:52:38
i2ctmr,memes,tteeggeerr,64498,please enjoy,i.redd.it,https://i.redd.it/rgce12mplle51.jpg,2020-08-02 14:22:10
i2byj1,todayilearned,jamescookenotthatone,20635,"TIL The Offspring's Album 'Smash' had a small budget of $20,000, which limited studio time, the last four songs recorded for the album were worked through in just two nights. 'Smash' went on to be the best-selling album released by an independent record label with over 11 million sales.",en.wikipedia.org,https://en.wikipedia.org/wiki/Smash_(The_Offspring_album),2020-08-02 13:21:48
i2bo3t,interestingasfuck,sarahjewel,105514,"Here are my removed &amp; genetically modified white blood cells, about to be put back in to hopefully cure my cancer! This is t-cell immunotherapy!",i.redd.it,https://i.redd.it/g1gln8xo7le51.jpg,2020-08-02 13:00:28
i2cfim,pics,Astreeter12,15595,How it feels to be a healthcare worker right now,i.redd.it,https://i.redd.it/3bvubjklhle51.jpg,2020-08-02 13:55:59
i2c6hk,woahdude,danschaubdesigns,17192,"You liked my other mask, figured I should share my more impressive art",i.redd.it,https://i.redd.it/m5juyibcele51.jpg,2020-08-02 13:37:43
i2ckgq,natureismetal,My_Memes_Will_Cure_U,14862,"Largest Elephant in the world, weighing approx 8000 kgs",i.imgur.com,https://i.imgur.com/whNSflo.gifv,2020-08-02 14:04:55
i2bwfp,funny,IzacLess,24463,When Dad says you're not allowed in the mud,i.redd.it,https://i.redd.it/p6s9mudzjje51.jpg,2020-08-02 13:17:33
i2dwat,wholesomememes,thetrickster420,19025,Happy reddit noises,i.redd.it,https://i.redd.it/bub4olkeyle51.jpg,2020-08-02 15:30:12
i2cbak,facepalm,wait_whats_illegal,38487,Hold up (found on twitter with #maga tag),i.imgur.com,https://i.imgur.com/Sb8QNXp.jpg,2020-08-02 13:47:32
i2ctg3,science,InvictusJoker,8236,"Scientists have discovered if they block PLpro (a viral protein), the SARS-CoV-2 virus production was inhibited and the innate immune response of the human cells was strengthened at the same time.",goethe-university-frankfurt.de,https://www.goethe-university-frankfurt.de/press-releases?year=2020,2020-08-02 14:21:48
i2c9tv,rareinsults,Roguecop,21750,Don't walk down wind of Karl he has not bathed since Halo 4 came out.,i.redd.it,https://i.redd.it/yfhjj58iele51.jpg,2020-08-02 13:44:22
i2c9jv,BikiniBottomTwitter,Cany0udance,16626,The site was better when the only option was gold,i.redd.it,https://i.redd.it/f039f5lcfle51.jpg,2020-08-02 13:43:48
i2b710,LeopardsAteMyFace,xbhaskarx,21161,Congressman Louie Gohmert’s (R-TX) daughter: “It’s not worth following a President who has no remorse for leading his followers to an early grave.”,i.imgur.com,https://i.imgur.com/BPb8iwd.jpg,2020-08-02 12:22:45
i2d6s6,agedlikemilk,TaxiDriver10101,9251,Trust Me,i.redd.it,https://i.redd.it/vbr5hbehqle51.jpg,2020-08-02 14:45:48
i2czdg,gifs,WhenMachinesCry,7813,Ringo Starr photo attempt,gfycat.com,https://gfycat.com/insistentsphericalkawala,2020-08-02 14:32:39
i2bx0i,WatchPeopleDieInside,ATJWen,30079,When your mom scolds you,v.redd.it,https://v.redd.it/7aq7jy9xale51,2020-08-02 13:18:48
i2b3rv,worldnews,hildebrand_rarity,59173,Americans Go Home: Canadians Track U.S. Boaters Sneaking Across The Border,npr.org,https://www.npr.org/2020/08/02/898165324/americans-go-home-canadians-track-u-s-boaters-sneaking-across-the-border?utm_medium=RSS&amp;utm_campaign=news,2020-08-02 12:15:12
i2b8gf,insanepeoplefacebook,Active-Ad-233,35470,Couldn't be more convincing,i.redd.it,https://i.redd.it/fmkweb1g1le51.jpg,2020-08-02 12:25:55
i2b4fv,NintendoSwitch,Zarski843,27551,Nintendo is really missing a huge opportunity by not porting Gamecube games over to Switch.,self.NintendoSwitch,https://www.reddit.com/r/NintendoSwitch/comments/i2b4fv/nintendo_is_really_missing_a_huge_opportunity_by/,2020-08-02 12:16:38
i2dlsu,ABoringDystopia,xforedk,6806,Anyway...,i.redd.it,https://i.redd.it/athpw622vle51.jpg,2020-08-02 15:11:30
i2ddj4,KidsAreFuckingStupid,embrmc,9633,A for effort.,i.redd.it,https://i.redd.it/4zpums4lsle51.jpg,2020-08-02 14:57:36
i2ev9d,gaming,PM-ME-YOUR-CUTE-SOCK,7034,Nothings worse than this..,i.redd.it,https://i.redd.it/2w1o9daqm2e31.jpg,2020-08-02 16:28:26
i2bszm,AnimalsBeingBros,Scullkrush,17645,Sharing is caring,v.redd.it,https://v.redd.it/qzvs2oqf9le51,2020-08-02 13:10:18
i2b05t,PoliticalHumor,MarxReadsRushdie,39352,"Imagine, if you will, an asshole",i.redd.it,https://i.redd.it/2wzzco52yke51.jpg,2020-08-02 12:06:28
i2bmsa,tifu,that_filming_guy,23608,TIFU by Becoming a Suspected Pedophile,self.tifu,https://www.reddit.com/r/tifu/comments/i2bmsa/tifu_by_becoming_a_suspected_pedophile/,2020-08-02 12:57:35
i2b3mg,PublicFreakout,Ghulam_Jewel,54670,Meeting up with your best friend after a long time,v.redd.it,https://v.redd.it/bk3osryhzke51,2020-08-02 12:14:51
i2anbq,assholedesign,Iescaunare,52408,Amazon Prime Video doesn't tell you if a show is unavailable in your country until after you subscribe to Amazon Prime.,i.redd.it,https://i.redd.it/y5gxwuz3ske51.png,2020-08-02 11:34:13
i2clsy,maybemaybemaybe,My_Memes_Will_Cure_U,10751,Maybe maybe maybe,i.imgur.com,https://i.imgur.com/mXEJHIf.gifv,2020-08-02 14:07:32
i2cprd,ShitPostCrusaders,FunnyValentineMP4,16801,JoJo's Bizarre Twitter Thread Continues,i.redd.it,https://i.redd.it/i0u947zxkle51.jpg,2020-08-02 14:14:52
i2ancl,nextfuckinglevel,NiceCasualRedditGuy,66298,What it's like to drive in a Seabreacher,v.redd.it,https://v.redd.it/6c6nhzf7ske51,2020-08-02 11:34:17
i2am87,awfuleverything,agentzuko,42641,The fact that this is so common is heartbreaking,i.redd.it,https://i.redd.it/0z8hqb4vrke51.jpg,2020-08-02 11:31:44
i2awad,news,Wise_Collection,15934,Egypt tells Musk pyramids were not built by aliens,bbc.com,https://www.bbc.com/news/world-africa-53627888,2020-08-02 11:57:15
i2bcg6,ScottishPeopleTwitter,CookieBitDBC,12255,constant struggle,i.redd.it,https://i.redd.it/38ulxxn53le51.png,2020-08-02 12:35:04
i2ar5p,videos,ASparrowe,20469,"My 30y/o mate started skateboarding a few months ago, today he landed his first kickflip, he posts videos for his close friends but i'm so proud i had to share.",youtube.com,https://www.youtube.com/watch?v=tNIoyBoHcL4&amp;t=0s,2020-08-02 11:43:57
i2au1o,TIHI,AristonD,28725,"Thanks, I hate chicken feet socks.",i.redd.it,https://i.redd.it/jugr869evke51.jpg,2020-08-02 11:51:31
i2cq49,therewasanattempt,jasontaken,10296,to attack mom,gfycat.com,https://gfycat.com/smugsnarlinghorseshoecrab-cats,2020-08-02 14:15:32
i2c9gc,menwritingwomen,tronixmastermind,8459,Wildin out at DnD lol,i.redd.it,https://i.redd.it/bnd2kerdfle51.jpg,2020-08-02 13:43:33
i2bhjz,PrequelMemes,KLASHINOV,24758,It's the little things in life...,i.redd.it,https://i.redd.it/3pkjn0j75le51.png,2020-08-02 12:46:36
i2az5a,HumansBeingBros,mulmer96,19451,Passed by this laying on the street outside during a walk,i.redd.it,https://i.redd.it/2b6gzacnxke51.jpg,2020-08-02 12:04:10
i2bhhq,MadeMeSmile,_PettyTheft,20212,How sweet it is,i.redd.it,https://i.redd.it/r65duns55le51.jpg,2020-08-02 12:46:28
i2aaa7,NatureIsFuckingLit,zaynthelegend,35894,"🔥 Beehive, Honey and Sunlight.",i.redd.it,https://i.redd.it/t7mi0s4gmke51.jpg,2020-08-02 11:01:36
i2bif9,HistoryPorn,Paul-Belgium,8836,"What is now the fully developed Las Vegas strip, 1955. [494 x 492]",i.redd.it,https://i.redd.it/mvmip6gk5le51.jpg,2020-08-02 12:48:33
i2bx5n,formuladank,faemsa,9194,Mercedes 1-2 confirmed… :(,i.redd.it,https://i.redd.it/z3x5ifx0ble51.jpg,2020-08-02 13:19:08
i2cwit,blackmagicfuckery,BlazingSpear,8839,Up is down and down is up,v.redd.it,https://v.redd.it/bo863p9umle51,2020-08-02 14:27:27
i2b80f,dndmemes,DungeonsWithFriends,14136,All That AC And Nothing To Do With It.,i.redd.it,https://i.redd.it/s09nqnbd1le51.jpg,2020-08-02 12:25:01
i2br8e,whatisthisthing,StpdF0x,9214,"This strange lightbulb i got at a thrift store. It gives off a strange sporadic glimmer when plugged in, it might just be broken.",gfycat.com,https://gfycat.com/graylivelygypsymoth,2020-08-02 13:06:37
i2budu,LateStageCapitalism,kevinowdziej,7369,Sounds heroic,i.redd.it,https://i.redd.it/edw6e8uy9le51.jpg,2020-08-02 13:13:12
i2cxp9,oddlyterrifying,Ipreferpintrest,7490,"My boyfriend fell asleep making pizza, it cooked for NINE HOURS",i.redd.it,https://i.redd.it/2x8pt7nlnle51.jpg,2020-08-02 14:29:40
i2b4ba,nottheonion,hildebrand_rarity,10311,Americans Go Home: Canadians Track U.S. Boaters Sneaking Across The Border,npr.org,https://www.npr.org/2020/08/02/898165324/americans-go-home-canadians-track-u-s-boaters-sneaking-across-the-border,2020-08-02 12:16:23
i2a6g8,WhitePeopleTwitter,zaynthelegend,32852,lol,i.redd.it,https://i.redd.it/lz5upbjmkke51.jpg,2020-08-02 10:51:18
i2dchz,BetterEveryLoop,My_Memes_Will_Cure_U,5473,He's getting better every loop,i.imgur.com,https://i.imgur.com/dzRh8Jz.gifv,2020-08-02 14:55:48
i2bfei,oddlysatisfying,wheelybindealer,12782,Awesome Carpentry,v.redd.it,https://v.redd.it/krk4w40w8je51,2020-08-02 12:41:36
i2cig3,BrandNewSentence,oldatlas,7199,long neck boi,i.redd.it,https://i.redd.it/m2anb1hkile51.jpg,2020-08-02 14:01:25
i2aujr,Unexpected,desire9me,22258,How to eat?,v.redd.it,https://v.redd.it/xfirdhdlvke51,2020-08-02 11:52:50
i2a77n,AnimalsBeingDerps,Max2713ger,30971,The perfect pillow doesn't exi-,i.redd.it,https://i.redd.it/zwmf68h0lke51.jpg,2020-08-02 10:53:20
i2aali,starterpacks,thestreetlife,27825,The 'you haven't lived til you've backpacked through South-East Asia' starter pack,i.redd.it,https://i.redd.it/ecz6v9ximke51.png,2020-08-02 11:02:17
i2ayhi,greentext,ericliu04,16766,Anon gets a hotdog,i.redd.it,https://i.redd.it/lme1h3ocxke51.jpg,2020-08-02 12:02:30
i2e7a7,FuckYouKaren,Bryles333,4594,No one has time for Karens,i.redd.it,https://i.redd.it/msup7vrq1me51.jpg,2020-08-02 15:48:53
i2akyn,AnimalCrossing,FunkyOperations,18405,"God Lionel, same.",i.redd.it,https://i.redd.it/ajpppsabrke51.jpg,2020-08-02 11:28:40
i2bpdc,Whatcouldgowrong,micnoo,11541,Kid stands in the middle of a bike ramp,v.redd.it,https://v.redd.it/7jus39hbahe51,2020-08-02 13:02:55
i2dtfm,UNBGBBIIVCHIDCTIICBG,YanniFromPakistanni,3824,Girl Coming Out Of Her Shell.,v.redd.it,https://v.redd.it/ev1l9smbxle51,2020-08-02 15:25:03
i29vyq,coolguides,PigsFlyOnMars,28171,How much musicians make from streams,i.redd.it,https://i.redd.it/gvzcljbcfke51.jpg,2020-08-02 10:21:33
i2dk7h,WhatsWrongWithYourDog,e_nathan,4258,My rescue dog trying to bury his doggie ice cream (lactose free) in the bed to save it for later.,v.redd.it,https://v.redd.it/uoyquvcgule51,2020-08-02 15:08:52
i2atzg,skyrim,WbtoOfficial,13612,Now this is what I call art,i.redd.it,https://i.redd.it/24s8yo9dvke51.jpg,2020-08-02 11:51:22
i2ai2q,DidntKnowIWantedThat,wheelybindealer,15786,Awesome Carpentry,v.redd.it,https://v.redd.it/krk4w40w8je51,2020-08-02 11:21:12
i2bi76,fightporn,SpiceBoi20,8880,Definitely not that guy's day,v.redd.it,https://v.redd.it/wfkhe98e5le51,2020-08-02 12:48:02
i2ea25,todayilearned,OrangElm,6111,"TIL that “TurboTax Free” is not actually free, but “TurboTax Free File” actually IS free (if you make under 36k). This was done to purposefully mislead the public into paying for a service that should be free according to the IRS.",theverge.com,https://www.theverge.com/2019/4/26/18518211/turbotax-free-tax-filing-hidden-google-search-results,2020-08-02 15:53:26
i29wmh,CasualUK,allthekos,21287,Sign in the local pub entrance!,i.redd.it,https://i.redd.it/lnr84bzofke51.jpg,2020-08-02 10:23:31
i2azla,Minecraft,069420,37013,Slime Volleyball,v.redd.it,https://v.redd.it/o2lgy51rxke51,2020-08-02 12:05:09
i2aisb,DunderMifflin,IVAN2CRY,15124,This was the biggest plot twist in cinema history.,i.redd.it,https://i.redd.it/wuezoexaqke51.jpg,2020-08-02 11:23:02
i2buk0,hmmm,sidshembekar,7974,hmmm,i.redd.it,https://i.redd.it/0etgfmr0ale51.jpg,2020-08-02 13:13:33
i2eleb,MurderedByWords,beerbellybegone,3961,"He's a real stand up fella, Tyrone is",i.redd.it,https://i.redd.it/bhz0yuep5me51.jpg,2020-08-02 16:12:02
i2cmjb,Rainbow6,LeaveHeat,7821,"Doc, on the subject of teammates [Voiceover + animation]",v.redd.it,https://v.redd.it/3b5ti5srjle51,2020-08-02 14:08:50
i2dpgo,Bad_Cop_No_Donut,Enlgoi,3541,Let’s get this going. The media needs to show this stuff we’ve been seeing everywhere but there.,i.redd.it,https://i.redd.it/thoqq8e8wle51.jpg,2020-08-02 15:18:08
i2cwy5,Instagramreality,PlasticSunMap,4360,the woman in the picture often posts about how people use angles to appear skinnier and to hide cellulite/skin blemishes - found on her instagram,i.redd.it,https://i.redd.it/cgw58nrcnle51.jpg,2020-08-02 14:28:16
i2ahqf,trippinthroughtime,f__h,13976,Every single time,i.imgur.com,https://i.imgur.com/P8b7q9X.jpg,2020-08-02 11:20:29
i2d521,formula1,magony,7050,Hamilton wins the British GP with a blown tire!,streamable.com,https://streamable.com/yjf1d9,2020-08-02 14:42:37
i2a6im,mildlyinteresting,atodaso,46750,I roasted the perfect marshmallow.,i.redd.it,https://i.redd.it/d30i7aenkke51.jpg,2020-08-02 10:51:27
i2ak7y,tumblr,Tagginga,12753,Technically the truth but damn,i.imgur.com,https://i.imgur.com/DsDpZ7M.jpg,2020-08-02 11:26:41
i2ctpq,lgbt,fukushiwa,5714,"Hello, I'm intersex, 36, and absolutely loving everything today! And I'm really feckin' happy, with me life, wife and adopted daughter 😁",i.redd.it,https://i.redd.it/8t72fgnamle51.jpg,2020-08-02 14:22:19
i2azss,food,MaxRamsey,7623,"[Homemade] Blueberry, nectarine and strawberry smoothie, blended with coconut milk, honey and ground cinnamon.",i.redd.it,https://i.redd.it/s1sdqyqwxke51.jpg,2020-08-02 12:05:37
i2afg5,gonewild,FloriaDanielson,9198,I’m share nudes on Gonewild everyday but non were ever [f]ocused on my kitty.. okay wow I’m nervous about this🙈,i.redd.it,https://i.redd.it/t88kgersoke51.jpg,2020-08-02 11:14:34
i29j7k,space,gibsonpics,21335,"Since I got into astrophotography I have built my own observatory to capture images of deep space, but my favorite picture I've captured was taken by my RV on the beach. [OC]",i.redd.it,https://i.redd.it/ho5118lp8ke51.jpg,2020-08-02 09:44:30
i2a27g,trashy,KeganO,20326,Such a waste,v.redd.it,https://v.redd.it/hs5522mgike51,2020-08-02 10:39:06
i2e1pn,WatchPeopleDieInside,Kiwi1338,11392,umm... what just happened?,v.redd.it,https://v.redd.it/1cwp4bazzle51,2020-08-02 15:39:27
i2c6o0,rarepuppers,JaimeAMendez,5577,Still Working On His Blue Steel,i.redd.it,https://i.redd.it/uhkqdwqeele51.jpg,2020-08-02 13:38:06
i29rk2,comics,zapphead,13367,[OC] Dungeon Cops #13,i.redd.it,https://i.redd.it/ou5n6881dke51.jpg,2020-08-02 10:08:37
i2c8ns,AvatarMemes,PsychologicalSpot0,5863,The boys together are like my last two brain cells during a test,i.redd.it,https://i.redd.it/jwa5nfr3fle51.jpg,2020-08-02 13:42:01
i2am8o,clevercomebacks,Active-Ad-233,12171,Couldn't be more convincing,i.redd.it,https://i.redd.it/rri9r7okrke51.jpg,2020-08-02 11:31:46
i29vi2,IdiotsInCars,DepressedBagel,19882,thas fucked up,v.redd.it,https://v.redd.it/fd67fw80fke51,2020-08-02 10:20:24
i2blyr,CODWarzone,lion909,5356,I never stop falling for them,i.redd.it,https://i.redd.it/a288c26v6le51.png,2020-08-02 12:55:50
i2c22m,UpliftingNews,speckz,4482,"Wyoming’s ‘Bird Lady’ offers a haven for injured birds - For the past 33 years, Susan Ahalt has run one of the only bird rehabilitation facilities in the state.",hcn.org,https://www.hcn.org/articles/birds-wyomings-bird-lady-offers-a-haven-for-injured-birds,2020-08-02 13:29:06
i2cxu3,SmashBrosUltimate,AyKayRay,4584,And G&amp;W too Ig,i.redd.it,https://i.redd.it/pmh7l8knnle51.jpg,2020-08-02 14:29:56
i2cnhb,gaming,Merryweatherey,15425,[OC] The Console Waifu Wars,i.redd.it,https://i.redd.it/32sy9id6kle51.jpg,2020-08-02 14:10:39
