id,subreddit,author,score,title,domain,url,created_utc
i25h3c,insanepeoplefacebook,FLtimeTraveler,20839,MAGA,i.redd.it,https://i.redd.it/sj02jwzzdie51.png,2020-08-02 03:31:12
i24gyz,wholesomememes,shrutika2312,47629,Love that friend &lt;3,v.redd.it,https://v.redd.it/zfrdrk4h0ie51,2020-08-02 02:15:10
i249eg,pics,cooked_khaleesi,28523,"Expecting our first child in September. My mother crocheted an octopus for her, suckers and all.",i.redd.it,https://i.redd.it/jyqgy69wxhe51.jpg,2020-08-02 02:00:13
i24rie,mildlyinteresting,HiggDownDiggs,18594,Found when this cone was finally removed after who knows how many months,i.redd.it,https://i.redd.it/zpgzc9754ie51.jpg,2020-08-02 02:37:15
i23wrj,WhitePeopleTwitter,My_Memes_Will_Cure_U,31950,Save the USPS,i.imgur.com,https://i.imgur.com/0S7xJjv.jpg,2020-08-02 01:34:29
i23zt6,todayilearned,EinFogel,20557,TIl Norway only spend 3% of their oil fund a year. Because they are saving for the next generation,bloomberg.com,https://www.bloomberg.com/news/articles/2019-10-01/norway-takes-cash-from-wealth-fund-for-first-time-since-may-2018,2020-08-02 01:40:31
i24hlg,TheLastAirbender,LegaciesLover75,17899,Toph's Family (Both Pictures),i.redd.it,https://i.redd.it/gj83zqds0ie51.jpg,2020-08-02 02:16:25
i247td,MadeMeSmile,St0pX,20558,Scary bridges are no stress,i.imgur.com,https://i.imgur.com/hqgwqFO.gifv,2020-08-02 01:56:50
i25gn5,movies,JoseTwitterFan,6466,"Wilford Brimley, 'The Thing' and 'Cocoon' Star, Dies at Age 85",popculture.com,https://popculture.com/celebrity/news/wilford-brimley-the-thing-cocoon-star-dead-85/,2020-08-02 03:30:16
i23qh1,baseball,StatusReality4,13591,Dodgers bench coach Bob Geren pulls down his mask to cough into the open air during in-game interview,v.redd.it,https://v.redd.it/6fn006jsqhe51,2020-08-02 01:22:06
i23i36,ABoringDystopia,outlawsoul,27861,Thanks for your service — but stop resisting fascism.,i.redd.it,https://i.redd.it/c94ku0vynhe51.jpg,2020-08-02 01:04:57
i25l0p,memes,f__h,26703,Gimme level 0,i.redd.it,https://i.redd.it/t3fnpv6bfie51.gif,2020-08-02 03:39:09
i24smv,OldSchoolCool,ChileanDorianGray,8409,My great great grandparents's wedding : Tzipe Fassler ( last name Haishelis before her marriage ) and Harry Fassler. Jewish immigrants from Bessarabia and Bukovina ( respectively) Photo taken in Manhattan NY in the year of 1911.,i.redd.it,https://i.redd.it/yfq8s7pw3ie51.jpg,2020-08-02 02:39:35
i23vkl,FoodPorn,realdecent,13033,"my partner is Colombian, I’m Korean. this is our attempt at fusion: the bandeja bibimbap",i.redd.it,https://i.redd.it/08zgodwwshe51.jpg,2020-08-02 01:32:17
i22uam,worldnews,ohnoh18,52672,The US ambassador to Brazil reportedly asked Brazilian officials to help Trump’s reelection,vox.com,https://www.vox.com/policy-and-politics/2020/8/1/21350810/us-ambassador-brazil-chapman-favor-ethanol-trump-reelection,2020-08-02 00:18:03
i22hif,politics,Twoweekswithpay,39882,New Emails Show Mike Pence Got Disgraced Governor Back Into the Navy After Sex Crime Charge: Report,lawandcrime.com,https://lawandcrime.com/high-profile/new-emails-show-mike-pence-got-disgraced-governor-eric-greitens-back-into-the-navy-after-sex-crime-charge-report/,2020-08-01 23:54:10
i250x0,TwoXChromosomes,Majnum,6653,"Rep. With COVID Says Health Choices Are Up To Him; Critics Say That’s What Women Have Been Saying | Rep. Louie Gohmert, who believes women should be forced to carry unwanted pregnancies to term, is suddenly all about (his) health choice freedoms.",huffpost.com,https://www.huffpost.com/entry/louie-gohmert-pro-choice-covid-19_n_5f2601e0c5b6a34284bba54f,2020-08-02 02:56:56
i23drp,cursedcomments,tjf314,45294,cursed_zeus,i.redd.it,https://i.redd.it/wdt3c3ihmhe51.jpg,2020-08-02 00:56:15
i23f57,aww,jamberlouie,22532,This is my first ever pet that’s all mine! Not my brothers. Not my parents. Not my kids. Now my (now ex) husband. ALL MINE! Y’all meet Cordelia Rose. A rescue that’s stolen my heart!,i.redd.it,https://i.redd.it/r5t8fc1zmhe51.jpg,2020-08-02 00:59:04
i245ts,TIHI,_NuggyUnyen_,15598,"Thanks, I hate people who sneeze during a panoramic photo",i.redd.it,https://i.redd.it/acroxdeqvhe51.jpg,2020-08-02 01:52:50
i23d97,science,Alexander0232,10180,Thermal disinfection successfully decontaminated N95 respirators without impairing structural integrity or function,cmaj.ca,https://www.cmaj.ca/content/early/2020/07/30/cmaj.201203,2020-08-02 00:55:12
i22d7b,BlackPeopleTwitter,thr3dimension,33017,Gotta get them tickets one way or another,i.redd.it,https://i.redd.it/j9h52gmx9he51.jpg,2020-08-01 23:45:53
i246tg,nextfuckinglevel,CORROSIVEMANGONOX,18400,How This Commercial Was Shot,v.redd.it,https://v.redd.it/4gjoj85wwhe51,2020-08-02 01:54:51
i21s89,interestingasfuck,Dr_Apk,84596,"SpaceX falcon 9 leaving Earth's atmosphere and created a ""Twilight Phenomenon""",gfycat.com,https://gfycat.com/blankbogusbongo,2020-08-01 23:07:38
i257p8,nba,Nyhrox,5058,[Post Game Thread] Toronto Raptors (47-18) defeat Los Angeles Lakers (50-15) by 107 - 92 with 33 points coming from Kyle Lowry,self.nba,https://www.reddit.com/r/nba/comments/i257p8/post_game_thread_toronto_raptors_4718_defeat_los/,2020-08-02 03:10:57
i22t88,WatchPeopleDieInside,yomamascub,27192,I can’t believe you’ve done this.,v.redd.it,https://v.redd.it/eiecc2w9fhe51,2020-08-02 00:15:59
i224bv,PoliticalHumor,kevinowdziej,20562,He'll make it go after ya grandma,i.redd.it,https://i.redd.it/5rtos0w17he51.jpg,2020-08-01 23:29:44
i25io3,youseeingthisshit,iamhoop,5619,Hitting the spot,v.redd.it,https://v.redd.it/no6gfsy3dge51,2020-08-02 03:34:12
i229p0,funny,DcKnox88,49519,"My friend turned 32 today. Here he is at 32, 31, 30 and 29.",imgur.com,https://imgur.com/GmYO7nm,2020-08-01 23:39:34
i238qn,GetMotivated,SunchiefZen,10977,The Cave you fear to enter ... [image],i.redd.it,https://i.redd.it/9eiwhqwkkhe51.jpg,2020-08-02 00:45:53
i246do,AnimalsBeingDerps,-stay-,10185,Next one's mine..bois,i.redd.it,https://i.redd.it/1z9g519swhe51.jpg,2020-08-02 01:53:58
i22ggd,oddlysatisfying,8912621,22202,"Finally finished my gem cat, I finished it the day before my birthday too.",v.redd.it,https://v.redd.it/qks0b71zahe51,2020-08-01 23:52:11
i22ee2,DunderMifflin,The_Goldy,18436,"I think we all live in the real world, here.",i.redd.it,https://i.redd.it/mu8rx3i7ahe51.jpg,2020-08-01 23:48:06
i2278m,books,sonofespresso,13411,The Princess Bride made me furious until I realized I was an idiot,self.books,https://www.reddit.com/r/books/comments/i2278m/the_princess_bride_made_me_furious_until_i/,2020-08-01 23:35:01
i235d7,AnimalsBeingBros,Thoughts-Uncensored,12489,Just looking after my new Siblings 😁😁😁,v.redd.it,https://v.redd.it/irfx7m2bjhe51,2020-08-02 00:38:55
i24776,madlads,youwrite,12014,Man smokes then wears mask,i.redd.it,https://i.redd.it/27jsvmq2xhe51.jpg,2020-08-02 01:55:36
i24nzx,dankmemes,Bleach4Prez87,17508,I mean they can but it’s not the type you’d think (plz don’t delete this mods. It’s a joke),i.redd.it,https://i.redd.it/203rhld73ie51.jpg,2020-08-02 02:29:57
i25fz0,therewasanattempt,Master1718,5365,To point a gun,i.imgur.com,https://i.imgur.com/6IBQEzW.gifv,2020-08-02 03:28:56
i22uza,comedyheaven,Zach-x-2,20120,Small fry,i.redd.it,https://i.redd.it/7o5ndiuufhe51.jpg,2020-08-02 00:19:22
i260al,sports,dreamteamreddit,3426,Michael Jordan donates $2.5 million to three organizations to combat Black voter suppression as part of his previous $100 million pledge,cnn.com,https://www.cnn.com/2020/07/30/us/michael-jordan-voter-suppression-trnd/index.html,2020-08-02 04:11:44
i223n3,BeAmazed,Master1718,15967,If you ever wondered what it looks like inside a tire when you drive,i.imgur.com,https://i.imgur.com/J3uiSsX.gifv,2020-08-01 23:28:23
i24ojj,HolUp,SceneyQueeney,9411,Just thought this might fit in here,i.redd.it,https://i.redd.it/za9zw44f3ie51.jpg,2020-08-02 02:31:10
i24sw9,nottheonion,auscrisos,4538,Chernobyl Fungus Could Protect Astronauts From Radiation On Deep-Space Missions,foxnews.com,https://www.foxnews.com/science/chernobyl-fungus-could-protect-astronauts-radiation-deep-space-missions.amp,2020-08-02 02:40:08
i21fyx,Whatcouldgowrong,noondo_-nibba,65412,Using a Walmart bag when bleaching your hair,i.redd.it,https://i.redd.it/9x6jz7n8zge51.jpg,2020-08-01 22:45:57
i24fha,dogswithjobs,ForeverSJC,4866,In training to help his future owner,v.redd.it,https://v.redd.it/tnts74kwzhe51,2020-08-02 02:12:09
i24xlb,blursedimages,I-AM-NOT-HIMESH,8679,Blursed_brand,i.redd.it,https://i.redd.it/1no1k23s6ie51.jpg,2020-08-02 02:50:03
i246xn,wholesomebpt,WhiskeyStoneCold,4991,Justa friendly reminder,i.redd.it,https://i.redd.it/a2708nhzwhe51.jpg,2020-08-02 01:55:06
i24dra,gadgets,auscrisos,4919,Elon Musk Claims His Mysterious Brain Chip Will Allow People To Hear Previously Impossible Sounds,independent.co.uk,https://www.independent.co.uk/life-style/gadgets-and-tech/news/elon-musk-neuralink-brain-chip-hearing-a9647306.html?amp,2020-08-02 02:08:31
i249ct,technicallythetruth,deadeadeadeadeaded,7457,No doubt about it,i.redd.it,https://i.redd.it/plbp6n0wxhe51.jpg,2020-08-02 02:00:09
i21npo,news,DonnieMostDefinitely,56319,Couple who yelled 'white power' at Black man and his girlfriend arrested for hate crimes,nbcnews.com,https://www.nbcnews.com/news/us-news/couple-who-yelled-white-power-black-man-his-girlfriend-arrested-n1235586,2020-08-01 22:59:59
i25x45,Minecraft,Beezlee01,5003,"Finally figured out how to make custom resource pack, so the first thing I did was add my dog who passed away 2 years ago. Love you Bailey!",i.redd.it,https://i.redd.it/b822l92vjie51.png,2020-08-02 04:05:00
i210zw,PrequelMemes,WH4Lomg,46259,Hello There 👀,i.redd.it,https://i.redd.it/ep3amupiuge51.jpg,2020-08-01 22:19:29
i24yho,apexlegends,zancray,4576,Quality of Life changes,i.redd.it,https://i.redd.it/zhwayp1j6ie51.png,2020-08-02 02:51:53
i20ndy,Wellthatsucks,DirePegasus,43870,"With my remaining 3% battery on my phone, I post this",i.redd.it,https://i.redd.it/xd69e1ibqge51.jpg,2020-08-01 21:55:59
i23djb,pics,pretty___bird,29110,Me and my latest project - a custom pine desk designed and built from scratch.,i.redd.it,https://i.redd.it/d408n5s1mhe51.jpg,2020-08-02 00:55:47
i23pqh,greentext,FunnyRedditGoblin,6437,Anon feels lonely,i.redd.it,https://i.redd.it/y68017wuqhe51.jpg,2020-08-02 01:20:47
i20eus,HumansBeingBros,Thund3rbolt,31824,This young man was seen recently in Ecuador putting a face mask on his dog before putting one on himself,v.redd.it,https://v.redd.it/tn159a9onge51,2020-08-01 21:41:33
i222j4,gaming,HeyitsTonyStark,13992,Updates everytime,i.redd.it,https://i.redd.it/fr98jn2g6he51.jpg,2020-08-01 23:26:20
i22d7w,zelda,barrettUSMC,9851,[OoT] Did anyone else see the resemblance right away?,i.redd.it,https://i.redd.it/3uudpyvx9he51.jpg,2020-08-01 23:45:56
i21ky7,perfectlycutscreams,C0pp3r1993,17137,I don’t think this has been posted here before so here you go,v.redd.it,https://v.redd.it/tix4soel0he51,2020-08-01 22:54:57
i205u7,pcmasterrace,Conflict63,42024,"After years of use, I finally decided to hit the buy button",i.redd.it,https://i.redd.it/q3mavymwkge51.png,2020-08-01 21:26:13
i24lw8,todayilearned,shaka_sulu,6807,"TIL Mr Clean Magic Erasers are the same material people use for insulating and soundproofing. It's also easy to buy and cheap, you can by 100 Magic Eraser equivalent for $5.53.",wqad.com,https://www.wqad.com/article/news/local/mr-clean-magic-erasers-too-expensive-try-generic-melamine-foam-its-the-same-thing/526-f27a449b-0486-40be-8e92-b36ec417bca7,2020-08-02 02:25:24
i1zf90,WTF,yvesroyce2,28768,Meanwhile in Florida,v.redd.it,https://v.redd.it/5hqtzvuybge51,2020-08-01 20:42:51
i20mop,gonewild,bigglepix,11838,thanks for lookin xo [f19],i.redd.it,https://i.redd.it/hykrea34qge51.jpg,2020-08-01 21:54:47
i246zp,meme,[deleted],8906,Adios,i.redd.it,https://i.redd.it/4r86bs3ywhe51.png,2020-08-02 01:55:12
i20vs1,modernwarfare,ADeerBoy,17173,"The infected were having a hard time, so I gave them a hand",v.redd.it,https://v.redd.it/1l2hxlojsge51,2020-08-01 22:10:08
i225ez,NatureIsFuckingLit,catsandchill45,10730,🔥 Man in India captures a rare photo of a black leopard,i.redd.it,https://i.redd.it/qeqj98td7he51.jpg,2020-08-01 23:31:36
i24iff,teenagers,Unlit_Candle,9831,MEN BEING RAPED IS REAL AND A PROBLEM,self.teenagers,https://www.reddit.com/r/teenagers/comments/i24iff/men_being_raped_is_real_and_a_problem/,2020-08-02 02:18:12
i24fsk,ATBGE,tchachi,3714,This tattoo,i.redd.it,https://i.redd.it/eac3wx750ie51.jpg,2020-08-02 02:12:48
i233zh,Damnthatsinteresting,DimitriSirenko,7236,An oil painting I made on 36x48” canvas,i.redd.it,https://i.redd.it/d52yumdxihe51.jpg,2020-08-02 00:36:18
i223nz,Breath_of_the_Wild,Xenialbo623,7947,Retro breath of the wild by Logan Carroll,i.redd.it,https://i.redd.it/pex4kyor6he51.jpg,2020-08-01 23:28:26
i20rm5,natureismetal,slothyCheetah,13784,My Nepenthes maxima murdered a hornet,i.imgur.com,https://i.imgur.com/dbu8Zb4.jpg,2020-08-01 22:02:59
i209l9,KidsAreFuckingStupid,djin31,22328,Mas-turd-piece,i.redd.it,https://i.redd.it/lkhaf1a5mge51.jpg,2020-08-01 21:32:35
i219o5,tifu,o_potus,14695,TIFU by showing a new hire what Reddit was.,self.tifu,https://www.reddit.com/r/tifu/comments/i219o5/tifu_by_showing_a_new_hire_what_reddit_was/,2020-08-01 22:34:51
i261v2,dataisbeautiful,pdwp90,2364,US airlines recently received billions in bailouts. I'm building a dashboard that tracks how much different publicly traded companies rely on government contracts and grants. [OC],quiverquant.com,https://www.quiverquant.com/sources/govcontracts,2020-08-02 04:15:21
i2248f,FortNiteBR,ReflectiveRuby,10799,Trying to clutch the game as the last guy in the squad.,v.redd.it,https://v.redd.it/6n3tuhay6he51,2020-08-01 23:29:32
i23qn6,AmateurRoomPorn,shades_of_cool,3961,Got a retro vibe going,i.redd.it,https://i.redd.it/ww2rh7g5rhe51.jpg,2020-08-02 01:22:25
i23ma8,funny,icouldbeconvinced,11913,We had our wedding cake remade for our 5th anniversary and this fat bastard took the first bite,i.redd.it,https://i.redd.it/hn29z20lphe51.jpg,2020-08-02 01:13:37
i23z0i,awfuleverything,TotoroYosh4321,5617,Smoke,i.redd.it,https://i.redd.it/db59orw2uhe51.jpg,2020-08-02 01:38:49
i20v0h,trashy,silentonc,15203,Florida,v.redd.it,https://v.redd.it/vquyi4jjsge51,2020-08-01 22:08:47
i22szu,nextfuckinglevel,super_monero,29931,Guy tests his homemade 1000W fleshlight,i.imgur.com,https://i.imgur.com/7dM5zw2.gifv,2020-08-02 00:15:31
i23spk,Terraria,ThatOneDudeFromAsia,5398,The Old Man's Curse. Reworked,i.redd.it,https://i.redd.it/vpc0gontrhe51.png,2020-08-02 01:26:37
i217o5,mildlyinfuriating,Jimbob_Shannon,18689,"That hotbar, though.",i.redd.it,https://i.redd.it/fvv3gzdnwge51.jpg,2020-08-01 22:31:27
i1z9qc,CrappyDesign,lol62056,36559,“Critical thinking”,i.redd.it,https://i.redd.it/7fk0d8qtbge51.jpg,2020-08-01 20:34:42
i1ytbq,gifs,CandidCounter,34729,You're telling me kids won't spread the rona more than it already is?,i.imgur.com,https://i.imgur.com/60wvT7t.gifv,2020-08-01 20:12:41
i219fo,mildlyinteresting,TheDangerStranger,82286,This plaque at the dog park commemorating a park record,i.redd.it,https://i.redd.it/ggdu6e5awge51.jpg,2020-08-01 22:34:24
i1z6o3,Coronavirus,Homunculistic,19041,US New cases of Coronavirus level off coincides with Coronavirus data being sent directly to White House versus CDC (July 15),91-divoc.com,http://91-divoc.com/pages/covid-visualization/?chart=countries&amp;highlight=United%20States&amp;show=25&amp;y=both&amp;scale=linear&amp;data=cases-daily-7&amp;data-source=jhu&amp;xaxis=right-12wk#countries,2020-08-01 20:30:18
i1zptk,FuckYouKaren,maazmellow,34596,Damn Karen,i.redd.it,https://i.redd.it/uadn6oc6gge51.jpg,2020-08-01 20:59:06
i23e46,OutOfTheLoop,maxamil432,4041,"What's going on with the guy that did the ""Primitive Technology"" videos on YouTube?",self.OutOfTheLoop,https://www.reddit.com/r/OutOfTheLoop/comments/i23e46/whats_going_on_with_the_guy_that_did_the/,2020-08-02 00:56:56
i251ih,wallstreetbets,LoseALotOfMoney,2722,billy no!,i.redd.it,https://i.redd.it/ehmjb9198ie51.jpg,2020-08-02 02:58:15
i235or,unpopularopinion,squeezy102,7746,"Quiet kids aren't ""quiet kids,"" its just the vast majority of the population talks way too goddamn much.",self.unpopularopinion,https://www.reddit.com/r/unpopularopinion/comments/i235or/quiet_kids_arent_quiet_kids_its_just_the_vast/,2020-08-02 00:39:36
i201n0,Eyebleach,Thund3rbolt,17577,Sea Otter filling her built in pocket with Krill cubes,gfycat.com,https://gfycat.com/distinctimmediatealaskanmalamute,2020-08-01 21:19:01
i24a4n,RealGirls,theoriginalcinn,3210,Boys used to tease me for my red hair and pale skin and glasses but apparently some people are into that!,i.redd.it,https://i.redd.it/ro6ji0e5yhe51.jpg,2020-08-02 02:01:38
i240e7,aww,305FUN,10415,Did you hear me say stop?,v.redd.it,https://v.redd.it/73tyk37kuhe51,2020-08-02 01:41:41
i21kx5,AbsoluteUnits,roy4512,7734,Look at this burrito!,i.redd.it,https://i.redd.it/17rmegjt0he51.jpg,2020-08-01 22:54:53
i20ouw,instantkarma,Bismarck_15,15210,Teen bullies the wrong kid at school and gets humiliated,v.redd.it,https://v.redd.it/60dftpz7efe51,2020-08-01 21:58:29
i20y2h,hmmm,TheViralClovers,11084,hmmm,i.redd.it,https://i.redd.it/sytmx21ltge51.jpg,2020-08-01 22:14:17
i20jrj,Jokes,eliogaming,16733,A man in a bar starts talking to a prostitute.,self.Jokes,https://www.reddit.com/r/Jokes/comments/i20jrj/a_man_in_a_bar_starts_talking_to_a_prostitute/,2020-08-01 21:49:59
i24ymq,politics,TLDR_Swinton,4400,"Rep. With COVID Says Health Choices Are Up To Him; Critics Say That’s What Women Have Been Saying | Rep. Louie Gohmert, who believes women should be forced to carry unwanted pregnancies to term, is suddenly all about (his) health choice freedoms.",huffpost.com,https://www.huffpost.com/entry/louie-gohmert-pro-choice-covid-19_n_5f2601e0c5b6a34284bba54f,2020-08-02 02:52:09
i2407z,PS4,BananaDook,3771,Happy Spider-Man day! Hope you like this poster I made! :) [image],i.redd.it,https://i.redd.it/o9zpcbbiuhe51.jpg,2020-08-02 01:41:18
