id,subreddit,author,score,title,domain,url,created_utc
i22uam,worldnews,ohnoh18,21981,The US ambassador to Brazil reportedly asked Brazilian officials to help Trump’s reelection,vox.com,https://www.vox.com/policy-and-politics/2020/8/1/21350810/us-ambassador-brazil-chapman-favor-ethanol-trump-reelection,2020-08-02 00:18:03
i22hif,politics,Twoweekswithpay,16544,New Emails Show Mike Pence Got Disgraced Governor Back Into the Navy After Sex Crime Charge: Report,lawandcrime.com,https://lawandcrime.com/high-profile/new-emails-show-mike-pence-got-disgraced-governor-eric-greitens-back-into-the-navy-after-sex-crime-charge-report/,2020-08-01 23:54:10
i23gdo,aww,-shrimpgumbo,15056,Cutie,i.redd.it,https://i.redd.it/5ydaruifnhe51.jpg,2020-08-02 01:01:33
i22klp,space,DanielJStein,15284,"I hiked over 15 miles to get this shot of Comet Neowise setting in one of the most iconic locations in the Adirondacks, NY",i.redd.it,https://i.redd.it/287g8154che51.jpg,2020-08-02 00:00:02
i21s89,interestingasfuck,Dr_Apk,40883,"SpaceX falcon 9 leaving Earth's atmosphere and created a ""Twilight Phenomenon""",gfycat.com,https://gfycat.com/blankbogusbongo,2020-08-01 23:07:38
i219fo,mildlyinteresting,TheDangerStranger,61152,This plaque at the dog park commemorating a park record,i.redd.it,https://i.redd.it/ggdu6e5awge51.jpg,2020-08-01 22:34:24
i21t2a,gaming,SirFox06,28746,Woop,i.redd.it,https://i.redd.it/gqlghprd3he51.jpg,2020-08-01 23:09:10
i22d7b,BlackPeopleTwitter,thr3dimension,10938,Gotta get them tickets one way or another,i.redd.it,https://i.redd.it/j9h52gmx9he51.jpg,2020-08-01 23:45:53
i21npo,news,DonnieMostDefinitely,37979,Couple who yelled 'white power' at Black man and his girlfriend arrested for hate crimes,nbcnews.com,https://www.nbcnews.com/news/us-news/couple-who-yelled-white-power-black-man-his-girlfriend-arrested-n1235586,2020-08-01 22:59:59
i21fyx,Whatcouldgowrong,noondo_-nibba,47057,Using a Walmart bag when bleaching your hair,i.redd.it,https://i.redd.it/9x6jz7n8zge51.jpg,2020-08-01 22:45:57
i20gvd,todayilearned,wintering6,40684,TIL that Louis Armstrong always wore a Star of David as an homage to a Jewish family that took him in when he was young and gave him his first horn,history.com,https://www.history.com/news/9-things-you-may-not-know-about-louis-armstrong,2020-08-01 21:44:54
i21q1r,funny,dr--moreau,21403,I found a very rare fossil on my walk today.,i.redd.it,https://i.redd.it/tjbmudif2he51.jpg,2020-08-01 23:03:51
i20riy,WatchPeopleDieInside,FacelessOnes,39870,98-yr old gramps can't handle the truth,v.redd.it,https://v.redd.it/omz9oyfarge51,2020-08-01 22:02:51
i20ndy,Wellthatsucks,DirePegasus,28822,"With my remaining 3% battery on my phone, I post this",i.redd.it,https://i.redd.it/xd69e1ibqge51.jpg,2020-08-01 21:55:59
i210zw,PrequelMemes,WH4Lomg,28870,Hello There 👀,i.redd.it,https://i.redd.it/ep3amupiuge51.jpg,2020-08-01 22:19:29
i23i36,ABoringDystopia,outlawsoul,5362,Thanks for your service — but stop resisting fascism.,i.redd.it,https://i.redd.it/c94ku0vynhe51.jpg,2020-08-02 01:04:57
i21wou,nba,urfaselol,7430,JJ Redick in deep thought as he realizes his playoff streak is ending this year,streamable.com,https://streamable.com/y5vskf,2020-08-01 23:15:47
i23drp,cursedcomments,tjf314,12468,cursed_zeus,i.redd.it,https://i.redd.it/wdt3c3ihmhe51.jpg,2020-08-02 00:56:15
i205u7,pcmasterrace,Conflict63,27045,"After years of use, I finally decided to hit the buy button",i.redd.it,https://i.redd.it/q3mavymwkge51.png,2020-08-01 21:26:13
i2278m,books,sonofespresso,6405,The Princess Bride made me furious until I realized I was an idiot,self.books,https://www.reddit.com/r/books/comments/i2278m/the_princess_bride_made_me_furious_until_i/,2020-08-01 23:35:01
i1zf90,WTF,yvesroyce2,18486,Meanwhile in Florida,v.redd.it,https://v.redd.it/5hqtzvuybge51,2020-08-01 20:42:51
i22ee2,DunderMifflin,The_Goldy,7156,"I think we all live in the real world, here.",i.redd.it,https://i.redd.it/mu8rx3i7ahe51.jpg,2020-08-01 23:48:06
i2177k,pics,JohnnyTeardrop,119166,"Person has balls, every other neighbor has Trump signs up",i.redd.it,https://i.redd.it/p2urui2gwge51.jpg,2020-08-01 22:30:34
i20eus,HumansBeingBros,Thund3rbolt,17075,This young man was seen recently in Ecuador putting a face mask on his dog before putting one on himself,v.redd.it,https://v.redd.it/tn159a9onge51,2020-08-01 21:41:33
i224bv,PoliticalHumor,kevinowdziej,6082,He'll make it go after ya grandma,i.redd.it,https://i.redd.it/5rtos0w17he51.jpg,2020-08-01 23:29:44
i1yxt1,WhitePeopleTwitter,codallas,33343,Hank would be so proud,i.redd.it,https://i.redd.it/n6ueclfe8ge51.jpg,2020-08-01 20:17:41
i20vs1,modernwarfare,ADeerBoy,11377,"The infected were having a hard time, so I gave them a hand",v.redd.it,https://v.redd.it/1l2hxlojsge51,2020-08-01 22:10:08
i1zptk,FuckYouKaren,maazmellow,25747,Damn Karen,i.redd.it,https://i.redd.it/uadn6oc6gge51.jpg,2020-08-01 20:59:06
i1z9qc,CrappyDesign,lol62056,29094,“Critical thinking”,i.redd.it,https://i.redd.it/7fk0d8qtbge51.jpg,2020-08-01 20:34:42
i223n3,BeAmazed,Master1718,6111,If you ever wondered what it looks like inside a tire when you drive,i.imgur.com,https://i.imgur.com/J3uiSsX.gifv,2020-08-01 23:28:23
i1ydw6,PublicFreakout,p14082003,55950,"Coronavirus car playing coffin dance music in Buenos Aires, Argentina. (My life is now complete)",v.redd.it,https://v.redd.it/i30t02an3ge51,2020-08-01 19:49:25
i1ytbq,gifs,CandidCounter,16193,You're telling me kids won't spread the rona more than it already is?,i.imgur.com,https://i.imgur.com/60wvT7t.gifv,2020-08-01 20:12:41
i238qn,GetMotivated,SunchiefZen,3848,The Cave you fear to enter ... [image],i.redd.it,https://i.redd.it/9eiwhqwkkhe51.jpg,2020-08-02 00:45:53
i1yz75,NatureIsFuckingLit,lol62056,22491,🔥 The Goldentail moray eel looks like a banana peel,i.imgur.com,https://i.imgur.com/EqYaInw.gifv,2020-08-01 20:19:02
i1z89s,videos,vertmart,25157,"Putting On 10 Masks &amp; Running 1 Km In 100°F Heat, After Smoking, To Prove Masks Can't Suffocate You",youtube.com,https://www.youtube.com/watch?v=HaMlNjzgj2E,2020-08-01 20:32:32
i1y513,nextfuckinglevel,regian24,61278,Soap bubble freezing in real time,v.redd.it,https://v.redd.it/mlkdaeuv0ge51,2020-08-01 19:35:14
i1z2o2,dankmemes,notkhaos,48392,"Make love, creatures!",i.redd.it,https://i.redd.it/wlfubt8y9ge51.jpg,2020-08-01 20:24:13
i22d7w,zelda,barrettUSMC,5412,[OoT] Did anyone else see the resemblance right away?,i.redd.it,https://i.redd.it/3uudpyvx9he51.jpg,2020-08-01 23:45:56
i1ydvk,Cringetopia,Maplegum,41901,"Change the world, my final message, goodbye.",i.redd.it,https://i.redd.it/nj3yd7ya3ge51.jpg,2020-08-01 19:49:23
i22kmh,memes,o0BiisLaaM0o,22762,"Bro,seriously wake up",i.redd.it,https://i.redd.it/k9dsa5c9che51.jpg,2020-08-02 00:00:04
i2248f,FortNiteBR,ReflectiveRuby,6336,Trying to clutch the game as the last guy in the squad.,v.redd.it,https://v.redd.it/6n3tuhay6he51,2020-08-01 23:29:32
i1z6o3,Coronavirus,Homunculistic,9900,US New cases of Coronavirus level off coincides with Coronavirus data being sent directly to White House versus CDC (July 15),91-divoc.com,http://91-divoc.com/pages/covid-visualization/?chart=countries&amp;highlight=United%20States&amp;show=25&amp;y=both&amp;scale=linear&amp;data=cases-daily-7&amp;data-source=jhu&amp;xaxis=right-12wk#countries,2020-08-01 20:30:18
i1yj5p,rareinsults,dlmDarkFire,32068,Sad love life,i.imgur.com,https://i.imgur.com/dtedkql.png,2020-08-01 19:58:46
i219o5,tifu,o_potus,6955,TIFU by showing a new hire what Reddit was.,self.tifu,https://www.reddit.com/r/tifu/comments/i219o5/tifu_by_showing_a_new_hire_what_reddit_was/,2020-08-01 22:34:51
i229p0,funny,DcKnox88,15254,"My friend turned 32 today. Here he is at 32, 31, 30 and 29.",imgur.com,https://imgur.com/GmYO7nm,2020-08-01 23:39:34
i1z1fq,Gunners,Thierry_Bergkamp,12547,"15,000 upvotes and I get this image tattooed on my body",i.redd.it,https://i.redd.it/eyb36xpl9ge51.jpg,2020-08-01 20:22:16
i20onq,pussypassdenied,sewer_pickles,6906,"Didn't ask for help, but blames others for bad manners",i.redd.it,https://i.redd.it/wzgeay2bqge51.jpg,2020-08-01 21:58:09
i20mop,gonewild,bigglepix,6095,thanks for lookin xo [f19],i.redd.it,https://i.redd.it/hykrea34qge51.jpg,2020-08-01 21:54:47
i1xels,LeopardsAteMyFace,Danceinthepurplerain,17349,"GOP railed against mail-in voting to try to depress turnout, suddenly realizes they might suffer as a result of these efforts",thehill.com,https://thehill.com/homenews/campaign/510040-gop-fears-trump-attacks-on-mail-in-vote-will-sabotage-turnout,2020-08-01 18:52:08
i1xkb0,me_irl,Arcaedus,32588,me_irl,i.redd.it,https://i.redd.it/91lt3yr3vfe51.png,2020-08-01 19:01:19
i1xdvr,dndmemes,JHossBoss,27497,"NPC idea: a rogue who pretends to be a wizard and uses stealth to do the ""magic."" H.P. Lovecraft: been there, done that.",i.redd.it,https://i.redd.it/bho10tobtfe51.jpg,2020-08-01 18:51:01
i20ouw,instantkarma,Bismarck_15,8521,Teen bullies the wrong kid at school and gets humiliated,v.redd.it,https://v.redd.it/60dftpz7efe51,2020-08-01 21:58:29
i1xf77,wholesomememes,Urk4,63339,Thank you parents,i.redd.it,https://i.redd.it/07ah892ptfe51.jpg,2020-08-01 18:53:06
i20v0h,trashy,silentonc,6868,Florida,v.redd.it,https://v.redd.it/vquyi4jjsge51,2020-08-01 22:08:47
i1xkgy,MadeMeSmile,The__Theory,32757,12 years,i.redd.it,https://i.redd.it/83lkwgl7vfe51.jpg,2020-08-01 19:01:35
i1xtug,lotrmemes,mamadpri,19713,If only this happened,i.redd.it,https://i.redd.it/dughohruxfe51.jpg,2020-08-01 19:16:45
i1wzem,facepalm,yomamascub,46241,One day...,i.redd.it,https://i.redd.it/0qgf6j63pfe51.jpg,2020-08-01 18:27:16
i217o5,mildlyinfuriating,Jimbob_Shannon,7502,"That hotbar, though.",i.redd.it,https://i.redd.it/fvv3gzdnwge51.jpg,2020-08-01 22:31:27
i1xlmz,EarthPorn,UllrHellfire,13758,"Mount Rainier National Park, [2252x4000] [OC]",i.redd.it,https://i.redd.it/5t8v6iijvfe51.jpg,2020-08-01 19:03:28
i1xjou,photoshopbattles,confibulator,15851,PsBattle: Cracked Pomegranate,i.imgur.com,https://i.imgur.com/YfcKJ3e.jpg,2020-08-01 19:00:21
i20h0a,Rainbow6,Prototype3120,9038,Time to get a new gaming chair,v.redd.it,https://v.redd.it/ctuzz0v6oge51,2020-08-01 21:45:08
i1xofl,tumblr,I_Did_Something_Nice,18638,This post seems universal,i.redd.it,https://i.redd.it/nju1hiqcwfe51.jpg,2020-08-01 19:08:02
i20rm5,natureismetal,slothyCheetah,5846,My Nepenthes maxima murdered a hornet,i.imgur.com,https://i.imgur.com/dbu8Zb4.jpg,2020-08-01 22:02:59
i20y2h,hmmm,TheViralClovers,5932,hmmm,i.redd.it,https://i.redd.it/sytmx21ltge51.jpg,2020-08-01 22:14:17
i1y2km,Minecraft,shifty_pickle,51859,Half a million blocks and 4 years later...,v.redd.it,https://v.redd.it/we931f4b0ge51,2020-08-01 19:31:21
i23qh1,baseball,StatusReality4,2471,Dodgers bench coach Bob Geren pulls down his mask to cough into the open air during in-game interview,v.redd.it,https://v.redd.it/6fn006jsqhe51,2020-08-02 01:22:06
i20nv3,ShitPostCrusaders,BlueBeetlePL,10893,She got lucky there,i.redd.it,https://i.redd.it/czw3utqgqge51.jpg,2020-08-01 21:56:46
i21ky7,perfectlycutscreams,C0pp3r1993,5333,I don’t think this has been posted here before so here you go,v.redd.it,https://v.redd.it/tix4soel0he51,2020-08-01 22:54:57
i209l9,KidsAreFuckingStupid,djin31,7609,Mas-turd-piece,i.redd.it,https://i.redd.it/lkhaf1a5mge51.jpg,2020-08-01 21:32:35
i22ggd,oddlysatisfying,8912621,3704,"Finally finished my gem cat, I finished it the day before my birthday too.",v.redd.it,https://v.redd.it/qks0b71zahe51,2020-08-01 23:52:11
i201n0,Eyebleach,Thund3rbolt,7557,Sea Otter filling her built in pocket with Krill cubes,gfycat.com,https://gfycat.com/distinctimmediatealaskanmalamute,2020-08-01 21:19:01
i20jrj,Jokes,eliogaming,6292,A man in a bar starts talking to a prostitute.,self.Jokes,https://www.reddit.com/r/Jokes/comments/i20jrj/a_man_in_a_bar_starts_talking_to_a_prostitute/,2020-08-01 21:49:59
i1zs16,chloe,SrGrafo,7139,Chloe #140 - NOM NOM NOM,i.redd.it,https://i.redd.it/yy8hvcplgge51.jpg,2020-08-01 21:02:41
i202qw,politics,dingo8yobb,11693,Impeachment Witness Vindman: U.S. Looks Increasingly Like ‘the Authoritarian Regime My Family Fled’,thedailybeast.com,https://www.thedailybeast.com/impeachment-star-alexander-vindman-says-us-becoming-like-ukraine-the-authoritarian-regime-my-family-fled,2020-08-01 21:20:59
i1w369,instant_regret,St0pX,49856,Dog touches insect and instantly regrets it.,imgur.com,https://imgur.com/9mqqFXk.gifv,2020-08-01 17:35:01
i1ymag,todayilearned,pm-me-gps-coords,74694,"TIL most Americans support eliminating the penny but attempts to do so have been stopped by Jarden Zinc Products, the sole provider of zinc penny blanks. Canada eliminated their penny in 2012.",en.wikipedia.org,https://en.wikipedia.org/wiki/Penny_debate_in_the_United_States,2020-08-01 20:04:19
i1y4ta,DnDGreentext,Jack5594,9104,Great taste imo,i.redd.it,https://i.redd.it/iqn8jpm51ge51.jpg,2020-08-01 19:34:56
i1zc7d,VALORANT,Zephyrrrrrrr,8351,The Knife is the worst weapon in Valorant.,v.redd.it,https://v.redd.it/6k93gl9v9ge51,2020-08-01 20:38:23
i1wfqg,gatekeeping,planet-lizard,24733,The best comeback for generational gate keeping,i.redd.it,https://i.redd.it/608eydjejfe51.jpg,2020-08-01 17:55:24
i20kfl,AbruptChaos,BlookyDJ,6126,FUCK,v.redd.it,https://v.redd.it/500qrwp9pge51,2020-08-01 21:51:06
i1wkpw,AskReddit,El_CM,34591,What is just a placebo effect but most people don't realize?,self.AskReddit,https://www.reddit.com/r/AskReddit/comments/i1wkpw/what_is_just_a_placebo_effect_but_most_people/,2020-08-01 18:03:30
i1xuf6,Steam,nerfMakoa,8916,The invisible cunt,i.redd.it,https://i.redd.it/25po92v2yfe51.jpg,2020-08-01 19:17:41
i1w4hs,blursedimages,MILDREDKING489,75899,blursed spongebob,i.redd.it,https://i.redd.it/gj9wrzq172e31.jpg,2020-08-01 17:37:07
i1y39n,insanepeoplefacebook,MrStilUrGrandma,11286,Not Facebook but still Insane,i.redd.it,https://i.redd.it/429btkwp0ge51.jpg,2020-08-01 19:32:29
i1ynu0,hockey,PaperMoonShine,6088,The Chicago Blackhawks have scored more goals in 1 playoff period than their entire series with Nashville in 2017.,self.hockey,https://www.reddit.com/r/hockey/comments/i1ynu0/the_chicago_blackhawks_have_scored_more_goals_in/,2020-08-01 20:06:14
i1yoeq,Art,idqbaka,9084,"New phone, me, digital, 2020",i.redd.it,https://i.redd.it/fmtzxrjv4ge51.jpg,2020-08-01 20:06:57
i20thw,HolUp,_DoraTheWhora_,7503,Holup,i.redd.it,https://i.redd.it/xsg5mt35sge51.jpg,2020-08-01 22:06:11
i1zguf,aww,danvap,25700,Wait what happened!!,v.redd.it,https://v.redd.it/no6gfsy3dge51,2020-08-01 20:45:11
i1zkyk,MaliciousCompliance,Holdfireblondie,5355,Lesson Plans Must Be Posted By The Door,self.MaliciousCompliance,https://www.reddit.com/r/MaliciousCompliance/comments/i1zkyk/lesson_plans_must_be_posted_by_the_door/,2020-08-01 20:51:13
i1zfk9,StarWars,juniorlax16,6592,So my neighbor just walked over and gave me this...,i.imgur.com,https://i.imgur.com/S1cxkkN.jpg,2020-08-01 20:43:19
i223nz,Breath_of_the_Wild,Xenialbo623,3069,Retro breath of the wild by Logan Carroll,i.redd.it,https://i.redd.it/pex4kyor6he51.jpg,2020-08-01 23:28:26
i1z1d0,interestingasfuck,dahnashk,36938,These carvings my dad made out of pencils in 1993,i.redd.it,https://i.redd.it/rbb4wffk9ge51.jpg,2020-08-01 20:22:10
i214u3,Chonkers,rahmanmuhammad,3855,A N G R Y,i.redd.it,https://i.redd.it/jf477l7rvge51.jpg,2020-08-01 22:26:26
i1yxcg,unpopularopinion,hezzyb,12133,"""If you don't have anything nice to say, don't say anything at all"" is why some people can't take constructive criticism",self.unpopularopinion,https://www.reddit.com/r/unpopularopinion/comments/i1yxcg/if_you_dont_have_anything_nice_to_say_dont_say/,2020-08-01 20:17:12
i1vllq,TheLastAirbender,jekkemenn,57247,Thought you guys might appreciate this recreation of the opening that I just finished working on with some friends... Let me know what you think! (Credits in Comments),v.redd.it,https://v.redd.it/m7m8acb0afe51,2020-08-01 17:06:03
i1we14,holdmyredbull,RedBullTastesLikeCok,14956,Bond. . . . James Bond.,v.redd.it,https://v.redd.it/nwjvnxyoife51,2020-08-01 17:52:35
i1z3wm,WritingPrompts,whereiswilson,6288,"[WP] The amount of money your soulmate currently has appears over your head. The number over your head has always been low. Then one day, while sitting it your car, it suddenly shoots up and surpasses $1,000,000. Seconds later, someone jumps into your car and yells, “DRIVE!”",self.WritingPrompts,https://www.reddit.com/r/WritingPrompts/comments/i1z3wm/wp_the_amount_of_money_your_soulmate_currently/,2020-08-01 20:26:00
i1zuy2,holdmyfeedingtube,stomaworst,5639,HMFT after I break my neck,v.redd.it,https://v.redd.it/nlsmsfrxode51,2020-08-01 21:07:24
i1xaqg,BikiniBottomTwitter,MasterWoland,12875,"Sucks to suck, lol.",i.redd.it,https://i.redd.it/vghs048dsfe51.jpg,2020-08-01 18:45:39
i22uza,comedyheaven,Zach-x-2,2857,Small fry,i.redd.it,https://i.redd.it/7o5ndiuufhe51.jpg,2020-08-02 00:19:22
