id,subreddit,author,score,title,domain,url,created_utc
i2d4fi,politics,DaFunkJunkie,22481,It's time to start handing out fines to people who refuse to wear masks,businessinsider.com,https://www.businessinsider.com/fines-needed-people-dont-wear-masks-covid-19-coronavirus-2020-7,2020-08-02 14:41:26
i2d73y,formula1,LordMcze,16694,[@Mercedes-AMG F1] HQYACQUACYQGABAHWVAKDBXKCOEHAPZHXNCYWKAJJZ,twitter.com,https://twitter.com/MercedesAMGF1/status/1289934431059410950?s=19,2020-08-02 14:46:20
i2bo3t,interestingasfuck,sarahjewel,77192,"Here are my removed &amp; genetically modified white blood cells, about to be put back in to hopefully cure my cancer! This is t-cell immunotherapy!",i.redd.it,https://i.redd.it/g1gln8xo7le51.jpg,2020-08-02 13:00:28
i2c2wx,BlackPeopleTwitter,Skyccord,20787,Harsh realities,i.redd.it,https://i.redd.it/wpk6cr15dle51.png,2020-08-02 13:30:59
i2b57d,Damnthatsinteresting,Master1718,38017,"Largest Elephant in the world ,8000 kg weight ,TANZANIA.",i.imgur.com,https://i.imgur.com/whNSflo.gifv,2020-08-02 12:18:31
i2cbak,facepalm,wait_whats_illegal,19613,Hold up (found on twitter with #maga tag),i.imgur.com,https://i.imgur.com/Sb8QNXp.jpg,2020-08-02 13:47:32
i2b3rv,worldnews,hildebrand_rarity,46588,Americans Go Home: Canadians Track U.S. Boaters Sneaking Across The Border,npr.org,https://www.npr.org/2020/08/02/898165324/americans-go-home-canadians-track-u-s-boaters-sneaking-across-the-border?utm_medium=RSS&amp;utm_campaign=news,2020-08-02 12:15:12
i2b05t,PoliticalHumor,MarxReadsRushdie,30370,"Imagine, if you will, an asshole",i.redd.it,https://i.redd.it/2wzzco52yke51.jpg,2020-08-02 12:06:28
i2c6hk,woahdude,danschaubdesigns,10389,"You liked my other mask, figured I should share my more impressive art",i.redd.it,https://i.redd.it/m5juyibcele51.jpg,2020-08-02 13:37:43
i2cds0,sadcringe,RyanWhittaerFE16,12507,Ahh,i.redd.it,https://i.redd.it/31yrcgozgle51.jpg,2020-08-02 13:52:38
i2b4fv,NintendoSwitch,Zarski843,20934,Nintendo is really missing a huge opportunity by not porting Gamecube games over to Switch.,self.NintendoSwitch,https://www.reddit.com/r/NintendoSwitch/comments/i2b4fv/nintendo_is_really_missing_a_huge_opportunity_by/,2020-08-02 12:16:38
i2b710,LeopardsAteMyFace,xbhaskarx,14918,Congressman Louie Gohmert’s (R-TX) daughter: “It’s not worth following a President who has no remorse for leading his followers to an early grave.”,i.imgur.com,https://i.imgur.com/BPb8iwd.jpg,2020-08-02 12:22:45
i2anbq,assholedesign,Iescaunare,44653,Amazon Prime Video doesn't tell you if a show is unavailable in your country until after you subscribe to Amazon Prime.,i.redd.it,https://i.redd.it/y5gxwuz3ske51.png,2020-08-02 11:34:13
i2b8gf,insanepeoplefacebook,Active-Ad-233,23835,Couldn't be more convincing,i.redd.it,https://i.redd.it/fmkweb1g1le51.jpg,2020-08-02 12:25:55
i2aojd,OldSchoolCool,gyrationreproduce,35074,52 years after my dad served on the USS Midway my family toured it and on the wall I found a picture of him sleeping on the Midway at age 18.,i.redd.it,https://i.redd.it/jn5j0astske51.jpg,2020-08-02 11:37:10
i2b3mg,PublicFreakout,Ghulam_Jewel,38834,Meeting up with your best friend after a long time,v.redd.it,https://v.redd.it/bk3osryhzke51,2020-08-02 12:14:51
i2c78x,funny,mzsuisse,13771,Ain’t that the truth!,i.redd.it,https://i.redd.it/3wctaurlele51.jpg,2020-08-02 13:39:14
i2bmsa,tifu,that_filming_guy,16852,TIFU by Becoming a Suspected Pedophile,self.tifu,https://www.reddit.com/r/tifu/comments/i2bmsa/tifu_by_becoming_a_suspected_pedophile/,2020-08-02 12:57:35
i2a9i0,pics,zaynthelegend,66516,Cat snuggled up on statue,i.redd.it,https://i.redd.it/y081ux53mke51.jpg,2020-08-02 10:59:42
i2am87,awfuleverything,agentzuko,32846,The fact that this is so common is heartbreaking,i.redd.it,https://i.redd.it/0z8hqb4vrke51.jpg,2020-08-02 11:31:44
i2ancl,nextfuckinglevel,NiceCasualRedditGuy,49700,What it's like to drive in a Seabreacher,v.redd.it,https://v.redd.it/6c6nhzf7ske51,2020-08-02 11:34:17
i2ar5p,videos,ASparrowe,16323,"My 30y/o mate started skateboarding a few months ago, today he landed his first kickflip, he posts videos for his close friends but i'm so proud i had to share.",youtube.com,https://www.youtube.com/watch?v=tNIoyBoHcL4&amp;t=0s,2020-08-02 11:43:57
i2afjc,news,yalsonbaka,24191,Portland police record highest number of death investigations in single month in more than three decades,oregonlive.com,https://www.oregonlive.com/crime/2020/07/portland-police-record-highest-number-of-death-investigations-in-single-month-in-more-than-three-decades.html,2020-08-02 11:14:48
i2bx0i,WatchPeopleDieInside,ATJWen,17311,When your mom scolds you,v.redd.it,https://v.redd.it/7aq7jy9xale51,2020-08-02 13:18:48
i2a4l8,aww,AndyToskovic,58056,Kid meets baby alpaca,v.redd.it,https://v.redd.it/swed3m8njke51,2020-08-02 10:46:03
i2bszm,AnimalsBeingBros,Scullkrush,11055,Sharing is caring,v.redd.it,https://v.redd.it/qzvs2oqf9le51,2020-08-02 13:10:18
i2au1o,TIHI,AristonD,21345,"Thanks, I hate chicken feet socks.",i.redd.it,https://i.redd.it/jugr869evke51.jpg,2020-08-02 11:51:31
i2aaa7,NatureIsFuckingLit,zaynthelegend,28759,"🔥 Beehive, Honey and Sunlight.",i.redd.it,https://i.redd.it/t7mi0s4gmke51.jpg,2020-08-02 11:01:36
i2ckgq,natureismetal,My_Memes_Will_Cure_U,7149,"Largest Elephant in the world, weighing approx 8000 kgs",i.imgur.com,https://i.imgur.com/whNSflo.gifv,2020-08-02 14:04:55
i2av0q,dankmemes,RegularNoodles,44846,Step brooo,i.redd.it,https://i.redd.it/dqzh7xgnvke51.gif,2020-08-02 11:54:01
i2az5a,HumansBeingBros,mulmer96,14541,Passed by this laying on the street outside during a walk,i.redd.it,https://i.redd.it/2b6gzacnxke51.jpg,2020-08-02 12:04:10
i2a6g8,WhitePeopleTwitter,zaynthelegend,22919,lol,i.redd.it,https://i.redd.it/lz5upbjmkke51.jpg,2020-08-02 10:51:18
i2a77n,AnimalsBeingDerps,Max2713ger,25366,The perfect pillow doesn't exi-,i.redd.it,https://i.redd.it/zwmf68h0lke51.jpg,2020-08-02 10:53:20
i2a271,memes,sijakas,96388,Confused flat earhers,i.redd.it,https://i.redd.it/56hqjqiaike51.jpg,2020-08-02 10:39:03
i2aali,starterpacks,thestreetlife,21751,The 'you haven't lived til you've backpacked through South-East Asia' starter pack,i.redd.it,https://i.redd.it/ecz6v9ximke51.png,2020-08-02 11:02:17
i2c9jv,BikiniBottomTwitter,Cany0udance,7457,The site was better when the only option was gold,i.redd.it,https://i.redd.it/f039f5lcfle51.jpg,2020-08-02 13:43:48
i29vyq,coolguides,PigsFlyOnMars,22850,How much musicians make from streams,i.redd.it,https://i.redd.it/gvzcljbcfke51.jpg,2020-08-02 10:21:33
i29tg1,MadeMeSmile,mayawerrkerceleb,37466,"On Christmas morning after we had opened all the gifts, Travis said he had one more big gift for me. I was a little confused on why he had gotten me a barstool but once I sat down and looked at him, I immediately knew what was happening. He later told me that the stool is from the bar we met",v.redd.it,https://v.redd.it/kw33f27ydke51,2020-08-02 10:14:17
i2bcg6,ScottishPeopleTwitter,CookieBitDBC,7792,constant struggle,i.redd.it,https://i.redd.it/38ulxxn53le51.png,2020-08-02 12:35:04
i2bx5n,formuladank,faemsa,6894,Mercedes 1-2 confirmed… :(,i.redd.it,https://i.redd.it/z3x5ifx0ble51.jpg,2020-08-02 13:19:08
i2c9tv,rareinsults,Roguecop,9324,Don't walk down wind of Karl he has not bathed since Halo 4 came out.,i.redd.it,https://i.redd.it/yfhjj58iele51.jpg,2020-08-02 13:44:22
i2b80f,dndmemes,DungeonsWithFriends,9928,All That AC And Nothing To Do With It.,i.redd.it,https://i.redd.it/s09nqnbd1le51.jpg,2020-08-02 12:25:01
i2bhjz,PrequelMemes,KLASHINOV,14147,It's the little things in life...,i.redd.it,https://i.redd.it/3pkjn0j75le51.png,2020-08-02 12:46:36
i29wmh,CasualUK,allthekos,19052,Sign in the local pub entrance!,i.redd.it,https://i.redd.it/lnr84bzofke51.jpg,2020-08-02 10:23:31
i2ayhi,greentext,ericliu04,12492,Anon gets a hotdog,i.redd.it,https://i.redd.it/lme1h3ocxke51.jpg,2020-08-02 12:02:30
i2cprd,ShitPostCrusaders,FunnyValentineMP4,8540,JoJo's Bizarre Twitter Thread Continues,i.redd.it,https://i.redd.it/i0u947zxkle51.jpg,2020-08-02 14:14:52
i2ai2q,DidntKnowIWantedThat,wheelybindealer,13176,Awesome Carpentry,v.redd.it,https://v.redd.it/krk4w40w8je51,2020-08-02 11:21:12
i2a6im,mildlyinteresting,atodaso,36822,I roasted the perfect marshmallow.,i.redd.it,https://i.redd.it/d30i7aenkke51.jpg,2020-08-02 10:51:27
i2atzg,skyrim,WbtoOfficial,10698,Now this is what I call art,i.redd.it,https://i.redd.it/24s8yo9dvke51.jpg,2020-08-02 11:51:22
i2ao1c,HongKong,Orhac,9552,"US Senator Josh Hawley had ""Free Hong Kong"" printed on a Houston Rockets basketball jersey",i.redd.it,https://i.redd.it/vayd1408ske51.png,2020-08-02 11:35:59
i2akyn,AnimalCrossing,FunkyOperations,12563,"God Lionel, same.",i.redd.it,https://i.redd.it/ajpppsabrke51.jpg,2020-08-02 11:28:40
i2azla,Minecraft,069420,28947,Slime Volleyball,v.redd.it,https://v.redd.it/o2lgy51rxke51,2020-08-02 12:05:09
i2br8e,whatisthisthing,StpdF0x,6058,"This strange lightbulb i got at a thrift store. It gives off a strange sporadic glimmer when plugged in, it might just be broken.",gfycat.com,https://gfycat.com/graylivelygypsymoth,2020-08-02 13:06:37
i2c9gc,menwritingwomen,tronixmastermind,5266,Wildin out at DnD lol,i.redd.it,https://i.redd.it/bnd2kerdfle51.jpg,2020-08-02 13:43:33
i2b0s4,cursedcomments,gypsy_fatty,29462,Cursed_plane,i.redd.it,https://i.redd.it/4sfv4ombyke51.jpg,2020-08-02 12:07:57
i2aisb,DunderMifflin,IVAN2CRY,10787,This was the biggest plot twist in cinema history.,i.redd.it,https://i.redd.it/wuezoexaqke51.jpg,2020-08-02 11:23:02
i2clsy,maybemaybemaybe,My_Memes_Will_Cure_U,5314,Maybe maybe maybe,i.imgur.com,https://i.imgur.com/mXEJHIf.gifv,2020-08-02 14:07:32
i2d30y,rickandmorty,Noel405,4207,Boys mind blowers,i.redd.it,https://i.redd.it/jxbktgsaple51.jpg,2020-08-02 14:39:09
i29j7k,space,gibsonpics,17002,"Since I got into astrophotography I have built my own observatory to capture images of deep space, but my favorite picture I've captured was taken by my RV on the beach. [OC]",i.redd.it,https://i.redd.it/ho5118lp8ke51.jpg,2020-08-02 09:44:30
i2bif9,HistoryPorn,Paul-Belgium,5510,"What is now the fully developed Las Vegas strip, 1955. [494 x 492]",i.redd.it,https://i.redd.it/mvmip6gk5le51.jpg,2020-08-02 12:48:33
i2b4ba,nottheonion,hildebrand_rarity,6029,Americans Go Home: Canadians Track U.S. Boaters Sneaking Across The Border,npr.org,https://www.npr.org/2020/08/02/898165324/americans-go-home-canadians-track-u-s-boaters-sneaking-across-the-border,2020-08-02 12:16:23
i29rk2,comics,zapphead,11265,[OC] Dungeon Cops #13,i.redd.it,https://i.redd.it/ou5n6881dke51.jpg,2020-08-02 10:08:37
i2afg5,gonewild,FloriaDanielson,7600,I’m share nudes on Gonewild everyday but non were ever [f]ocused on my kitty.. okay wow I’m nervous about this🙈,i.redd.it,https://i.redd.it/t88kgersoke51.jpg,2020-08-02 11:14:34
i2a27g,trashy,KeganO,14665,Such a waste,v.redd.it,https://v.redd.it/hs5522mgike51,2020-08-02 10:39:06
i2ahqf,trippinthroughtime,f__h,10052,Every single time,i.imgur.com,https://i.imgur.com/P8b7q9X.jpg,2020-08-02 11:20:29
i29ror,wholesomememes,tuber_simulator,29600,You get what you deserve!!!,i.redd.it,https://i.redd.it/9nq9dnv3dke51.jpg,2020-08-02 10:09:02
i2911c,mildlyinfuriating,BadUsername25,41767,I can't read the article about pointless monthly subscriptions without buying a monthly subscription,i.redd.it,https://i.redd.it/df70f1ohzje51.png,2020-08-02 08:52:42
i299mq,Eyebleach,My_Memes_Will_Cure_U,37950,"Bröther, may I have some lämp?",i.imgur.com,https://i.imgur.com/iI5pgFo.gifv,2020-08-02 09:17:43
i2b3sq,Whatcouldgowrong,sneakyhog,8136,WCGW when pointing a gun,i.imgur.com,https://i.imgur.com/6IBQEzW.gifv,2020-08-02 12:15:16
i2d6s6,agedlikemilk,TaxiDriver10101,3761,Trust Me,i.redd.it,https://i.redd.it/vbr5hbehqle51.jpg,2020-08-02 14:45:48
i2am8o,clevercomebacks,Active-Ad-233,9316,Couldn't be more convincing,i.redd.it,https://i.redd.it/rri9r7okrke51.jpg,2020-08-02 11:31:46
i2d521,formula1,magony,5740,Hamilton wins the British GP with a blown tire!,streamable.com,https://streamable.com/yjf1d9,2020-08-02 14:42:37
i2bsyq,ATBGE,lajosyext,4728,DeSmallorean,i.redd.it,https://i.redd.it/76h4f3uf9le51.jpg,2020-08-02 13:10:15
i29vi2,IdiotsInCars,DepressedBagel,14127,thas fucked up,v.redd.it,https://v.redd.it/fd67fw80fke51,2020-08-02 10:20:24
i2bi76,fightporn,SpiceBoi20,5458,Definitely not that guy's day,v.redd.it,https://v.redd.it/wfkhe98e5le51,2020-08-02 12:48:02
i28wfx,Tinder,headpatkelly,36786,i was not prepared for this to work,i.redd.it,https://i.redd.it/t6zjchlywje51.png,2020-08-02 08:38:52
i2aiet,dontyouknowwhoiam,Cidixat,7211,“Sorry but you really don’t look like someone who likes the Witcher”,i.imgur.com,https://i.imgur.com/EFUcixn.jpg,2020-08-02 11:22:03
i2byj1,todayilearned,jamescookenotthatone,4394,"TIL The Offspring's Album 'Smash' had a small budget of $20,000, which limited studio time, the last four songs recorded for the album were worked through in just two nights. 'Smash' went on to be the best-selling album released by an independent record label with over 11 million sales.",en.wikipedia.org,https://en.wikipedia.org/wiki/Smash_(The_Offspring_album),2020-08-02 13:21:48
i2aujr,Unexpected,desire9me,8953,How to eat?,v.redd.it,https://v.redd.it/xfirdhdlvke51,2020-08-02 11:52:50
i28sbt,WTF,Chubk1n,21453,Guy runs onto F1 track during a race!,v.redd.it,https://v.redd.it/mowelesuuje51,2020-08-02 08:27:14
i2b2pk,teenagers,Randomaniac03,21979,My crush didn't agree to go on a date,self.teenagers,https://www.reddit.com/r/teenagers/comments/i2b2pk/my_crush_didnt_agree_to_go_on_a_date/,2020-08-02 12:12:38
i28ydd,pcmasterrace,Heckin_Gecker,30764,It gives me a strange sense of power seeing an fps count that big in the corner,i.imgur.com,https://i.imgur.com/sXzYMf2.jpg,2020-08-02 08:44:31
i2ak7y,tumblr,Tagginga,7830,Technically the truth but damn,i.imgur.com,https://i.imgur.com/DsDpZ7M.jpg,2020-08-02 11:26:41
i2a2ik,confusing_perspective,J4n_4,9887,Pipe or Rafiki?,i.redd.it,https://i.redd.it/h6iqvz8nike51.jpg,2020-08-02 10:40:04
i29ljf,YouShouldKnow,SweetTeaBags,11499,YSK that you are not a professionally trained therapist and that the burden of helping someone who is suicidal is not on you.,self.YouShouldKnow,https://www.reddit.com/r/YouShouldKnow/comments/i29ljf/ysk_that_you_are_not_a_professionally_trained/,2020-08-02 09:51:16
i2acuv,specializedtools,Better__Off_Dead,6419,Tool to put on/take off clips to hold baseboard corner pieces on before nailing them in place,i.imgur.com,https://i.imgur.com/FKSdkM2.gifv,2020-08-02 11:07:34
i2bwfp,funny,IzacLess,10839,When Dad says you're not allowed in the mud,i.redd.it,https://i.redd.it/p6s9mudzjje51.jpg,2020-08-02 13:17:33
i2budu,LateStageCapitalism,kevinowdziej,3954,Sounds heroic,i.redd.it,https://i.redd.it/edw6e8uy9le51.jpg,2020-08-02 13:13:12
i2ctpq,lgbt,fukushiwa,3571,"Hello, I'm intersex, 36, and absolutely loving everything today! And I'm really feckin' happy, with me life, wife and adopted daughter 😁",i.redd.it,https://i.redd.it/8t72fgnamle51.jpg,2020-08-02 14:22:19
i2a003,AbruptChaos,NiceEthanoob,10184,half life physics,v.redd.it,https://v.redd.it/htwiy1bdhke51,2020-08-02 10:33:02
i2b5wr,reddeadredemption,reddeaduniverse,5398,RDR2 - Arthur's vs. John's drawing comparison,i.redd.it,https://i.redd.it/ab4kbc1g0le51.png,2020-08-02 12:20:14
i2awju,dogelore,QazGod,7713,Le questionable trash talking has arrived,i.redd.it,https://i.redd.it/56y40ayiwke51.jpg,2020-08-02 11:57:56
i2auof,Showerthoughts,cadagricomiguel,9991,"You still haven't realized why you laugh when tickled, it's not even funny, it's irritating",self.Showerthoughts,https://www.reddit.com/r/Showerthoughts/comments/i2auof/you_still_havent_realized_why_you_laugh_when/,2020-08-02 11:53:08
i2bzyj,relationship_advice,ThrowRAimsterile,4454,My wife [31F] is pregnant and I’ve [34M] had a vasectomy. Can’t be mine.,self.relationship_advice,https://www.reddit.com/r/relationship_advice/comments/i2bzyj/my_wife_31f_is_pregnant_and_ive_34m_had_a/,2020-08-02 13:24:50
i2b3dg,PoliticalCompassMemes,somepommy,6281,Someone called me racist on the internet so now I love free market capitalism,i.redd.it,https://i.redd.it/xxfvardvyke51.png,2020-08-02 12:14:11
i2blyr,CODWarzone,lion909,4001,I never stop falling for them,i.redd.it,https://i.redd.it/a288c26v6le51.png,2020-08-02 12:55:50
i28kur,Coronavirus,kogeliz,15038,"White House opposes requirement for passengers to wear masks on planes, trains",reuters.com,https://www.reuters.com/article/us-health-coronavirus-airlines-idUSKCN24V3NC,2020-08-02 08:05:28
i29v68,modernwarfare,WillyWaggler,9354,Today my life peaked,v.redd.it,https://v.redd.it/dgfzaa4ueke51,2020-08-02 10:19:31
i2ckyi,Amd,omghag18,3188,Noice,i.redd.it,https://i.redd.it/7jfnye4djle51.jpg,2020-08-02 14:05:53
i2awad,news,Wise_Collection,10256,Egypt tells Musk pyramids were not built by aliens,bbc.com,https://www.bbc.com/news/world-africa-53627888,2020-08-02 11:57:15
