id,subreddit,author,score,title,domain,url,created_utc
i28azy,MovieDetails,shir0uemiya,14169,"In X-Men First Class, 2011. Hugh Jackman used 8 takes to try to get his line just right. The line was originally, ""fuck off"" but on the 8th take Jackman improvised by saying, ""go fuck yourself""; which became the line used in the film and also gave a genuine reaction from McAvoy and Fassbender.",i.redd.it,https://i.redd.it/h8vsm393mje51.jpg,2020-08-02 07:37:35
i27oo0,facepalm,Post-Narrow,26622,MAGA,i.redd.it,https://i.redd.it/kg7dmeszaje51.png,2020-08-02 06:36:32
i27wg1,funny,bigpapaape13,15335,Ohmmm,i.redd.it,https://i.redd.it/bcskh2qxeje51.jpg,2020-08-02 06:57:29
i27tqh,PrequelMemes,Y-Boi,25955,My man was packing it,i.redd.it,https://i.redd.it/yxbx26endje51.jpg,2020-08-02 06:50:18
i26zhv,oddlysatisfying,lifeisalwaysintheway,31847,Car gets fixed. (Last attempt to post in correct format),gfycat.com,https://gfycat.com/immenseeverlastingcrustacean,2020-08-02 05:32:23
i27l46,nextfuckinglevel,Araragi_Monogatari,26007,Craftsmanship of the highest order,v.redd.it,https://v.redd.it/4utst2m89je51,2020-08-02 06:27:40
i26d5c,interestingasfuck,Readingislove,61007,Spotted a rainbow cloud from my balcony. Not as beautiful as Aurora but pretty rare to see such phenomena in India.,i.redd.it,https://i.redd.it/9cn9k91eqie51.jpg,2020-08-02 04:39:55
i26tea,aww,Dom_33,28442,It’s a great feeling knowing that he can relax because he trusts me. I love this feeling 🥰🥰,i.redd.it,https://i.redd.it/gur2f6j4xie51.jpg,2020-08-02 05:17:41
i261v2,dataisbeautiful,pdwp90,14443,US airlines recently received billions in bailouts. I'm building a dashboard that tracks how much different publicly traded companies rely on government contracts and grants. [OC],quiverquant.com,https://www.quiverquant.com/sources/govcontracts,2020-08-02 04:15:21
i28c9e,dankmemes,pretransitionmtf44,20617,Error 404 Title Not Found,i.redd.it,https://i.redd.it/h7rvdcipmje51.jpg,2020-08-02 07:41:03
i27mgp,gtaonline,BIGpoppaKEGdog,11985,"We've all seen people fly through tunnels, but what about 2 people flying backwards through Maze Bank Arena",v.redd.it,https://v.redd.it/gzf4d9vt9je51,2020-08-02 06:31:18
i2775u,KidsAreFuckingStupid,a_bizz,12467,But what if?,i.redd.it,https://i.redd.it/vjply7q53je51.jpg,2020-08-02 05:51:29
i25gn5,movies,JoseTwitterFan,18966,"Wilford Brimley, 'The Thing' and 'Cocoon' Star, Dies at Age 85",popculture.com,https://popculture.com/celebrity/news/wilford-brimley-the-thing-cocoon-star-dead-85/,2020-08-02 03:30:16
i26f3p,toptalent,memezzer,14923,Traditional Finnish polka tune,v.redd.it,https://v.redd.it/91n2etz0rie51,2020-08-02 04:44:08
i260al,sports,dreamteamreddit,14561,Michael Jordan donates $2.5 million to three organizations to combat Black voter suppression as part of his previous $100 million pledge,cnn.com,https://www.cnn.com/2020/07/30/us/michael-jordan-voter-suppression-trnd/index.html,2020-08-02 04:11:44
i26oib,rareinsults,Amiracle217,20375,Absolutely ruined by his own kid,i.redd.it,https://i.redd.it/nzsl2qe2vie51.jpg,2020-08-02 05:06:07
i26q3h,Whatcouldgowrong,memezzer,16025,WCGW using a hot chainsaw to cut a palm tree,v.redd.it,https://v.redd.it/9rgjnatjvie51,2020-08-02 05:09:43
i27fyd,WatchPeopleDieInside,wilymon,12401,Woman prepares for gender reveal party,v.redd.it,https://v.redd.it/k2kmoeq27je51,2020-08-02 06:14:18
i25tvd,BlackPeopleTwitter,JayZGatsby,17704,Starting to feel like it may never happen,i.redd.it,https://i.redd.it/2enve6nwiie51.jpg,2020-08-02 03:57:58
i28act,memes,Infinix_007,22512,It's wholesome,i.postimg.cc,https://i.postimg.cc/wvv98ds3/download-2-2.jpg,2020-08-02 07:35:43
i25h3c,insanepeoplefacebook,FLtimeTraveler,59256,MAGA,i.redd.it,https://i.redd.it/sj02jwzzdie51.png,2020-08-02 03:31:12
i26f45,meirl,Bmchris44,11225,meirl,i.redd.it,https://i.redd.it/o4xrxh94rie51.png,2020-08-02 04:44:10
i24ymq,politics,TLDR_Swinton,18539,"Rep. With COVID Says Health Choices Are Up To Him; Critics Say That’s What Women Have Been Saying | Rep. Louie Gohmert, who believes women should be forced to carry unwanted pregnancies to term, is suddenly all about (his) health choice freedoms.",huffpost.com,https://www.huffpost.com/entry/louie-gohmert-pro-choice-covid-19_n_5f2601e0c5b6a34284bba54f,2020-08-02 02:52:09
i28wfx,Tinder,headpatkelly,3682,i was not prepared for this to work,i.redd.it,https://i.redd.it/t6zjchlywje51.png,2020-08-02 08:38:52
i25io3,youseeingthisshit,iamhoop,21530,Hitting the spot,v.redd.it,https://v.redd.it/no6gfsy3dge51,2020-08-02 03:34:12
i26eqh,iamatotalpieceofshit,ohlongjohnso,15171,The legal system is not working. Evidence.,i.redd.it,https://i.redd.it/lziu8i4wqie51.png,2020-08-02 04:43:16
i25bao,WhitePeopleTwitter,tetrahedron0,21020,This,i.redd.it,https://i.redd.it/fb52le9xbie51.jpg,2020-08-02 03:18:49
i27f7d,lotrmemes,kamikazeee,6991,Hope it’s not a repost,i.imgur.com,https://i.imgur.com/VSiUKTe.jpg,2020-08-02 06:12:16
i250x0,TwoXChromosomes,Majnum,16682,"Rep. With COVID Says Health Choices Are Up To Him; Critics Say That’s What Women Have Been Saying | Rep. Louie Gohmert, who believes women should be forced to carry unwanted pregnancies to term, is suddenly all about (his) health choice freedoms.",huffpost.com,https://www.huffpost.com/entry/louie-gohmert-pro-choice-covid-19_n_5f2601e0c5b6a34284bba54f,2020-08-02 02:56:56
i24gyz,wholesomememes,shrutika2312,93545,Love that friend &lt;3,v.redd.it,https://v.redd.it/zfrdrk4h0ie51,2020-08-02 02:15:10
i285lf,gaming,yut777_,5495,Got my first job and bought this mouse and mouse pad with my own money!,i.redd.it,https://i.redd.it/vrxxn0pdjje51.jpg,2020-08-02 07:22:27
i249eg,pics,cooked_khaleesi,63091,"Expecting our first child in September. My mother crocheted an octopus for her, suckers and all.",i.redd.it,https://i.redd.it/jyqgy69wxhe51.jpg,2020-08-02 02:00:13
i272y8,gifs,Raptor-A,6029,Receipt boomerang,i.redd.it,https://i.redd.it/oj04l1h61je51.gif,2020-08-02 05:40:43
i2567o,me_irl,Rawbonesinattentive,32021,Me_irl,preview.redd.it,https://preview.redd.it/04gq997e1jf41.jpg?width=640&amp;crop=smart&amp;auto=webp&amp;s=8452576a85098276df347b53367105f631ee3b91,2020-08-02 03:07:59
i2833x,Minecraft,TNTree_,8572,"Inspired by my Rube Goldberg Machine, I made a Arrow Juggler",v.redd.it,https://v.redd.it/xjcobpy1ije51,2020-08-02 07:15:31
i28ddy,FuckYouKaren,Modern_monkcharlie,4953,How dare you?,i.redd.it,https://i.redd.it/46sbro79nje51.png,2020-08-02 07:44:08
i24lw8,todayilearned,shaka_sulu,22900,"TIL Mr Clean Magic Erasers are the same material people use for insulating and soundproofing. It's also easy to buy and cheap, you can by 100 Magic Eraser equivalent for $5.53.",wqad.com,https://www.wqad.com/article/news/local/mr-clean-magic-erasers-too-expensive-try-generic-melamine-foam-its-the-same-thing/526-f27a449b-0486-40be-8e92-b36ec417bca7,2020-08-02 02:25:24
i272aw,PublicFreakout,what-a-bummer,10413,Teens volunteer to get pepper sprayed. Doesn't end well.,v.redd.it,https://v.redd.it/fo4rnbxv0je51,2020-08-02 05:39:07
i27ods,blursedimages,DMK-Max,10959,blursed_crypto money,i.redd.it,https://i.redd.it/18kavhp1bje51.png,2020-08-02 06:35:55
i25fz0,therewasanattempt,Master1718,21871,To point a gun,i.imgur.com,https://i.imgur.com/6IBQEzW.gifv,2020-08-02 03:28:56
i24smv,OldSchoolCool,ChileanDorianGray,17563,My great great grandparents's wedding : Tzipe Fassler ( last name Haishelis before her marriage ) and Harry Fassler. Jewish immigrants from Bessarabia and Bukovina ( respectively) Photo taken in Manhattan NY in the year of 1911.,i.redd.it,https://i.redd.it/yfq8s7pw3ie51.jpg,2020-08-02 02:39:35
i247td,MadeMeSmile,St0pX,50995,Scary bridges are no stress,i.imgur.com,https://i.imgur.com/hqgwqFO.gifv,2020-08-02 01:56:50
i24hlg,TheLastAirbender,LegaciesLover75,33815,Toph's Family (Both Pictures),i.redd.it,https://i.redd.it/gj83zqds0ie51.jpg,2020-08-02 02:16:25
i27m6x,ANormalDayInRussia,vanya13,5001,"Like many of us, vending machine, too many of us...",i.redd.it,https://i.redd.it/x2zpzaq4aje51.jpg,2020-08-02 06:30:37
i284u6,woooosh,Slaurits,5485,First time here,i.redd.it,https://i.redd.it/je9owtf1jje51.jpg,2020-08-02 07:20:30
i28dn5,ProgrammerHumor,DangerousImplication,3179,When you spend so much time multiplying by 2,i.redd.it,https://i.redd.it/1v3wwivdnje51.jpg,2020-08-02 07:44:51
i25q04,SuddenlyGay,jsom25gaming,11453,Finally some privacy,v.redd.it,https://v.redd.it/n9rbnm9ghie51,2020-08-02 03:49:53
i24sw9,nottheonion,auscrisos,11462,Chernobyl Fungus Could Protect Astronauts From Radiation On Deep-Space Missions,foxnews.com,https://www.foxnews.com/science/chernobyl-fungus-could-protect-astronauts-radiation-deep-space-missions.amp,2020-08-02 02:40:08
i28dy5,suicidebywords,My_Memes_Will_Cure_U,3567,Making America great again,i.imgur.com,https://i.imgur.com/xBe0dUJ.png,2020-08-02 07:45:41
i23qh1,baseball,StatusReality4,21146,Dodgers bench coach Bob Geren pulls down his mask to cough into the open air during in-game interview,v.redd.it,https://v.redd.it/6fn006jsqhe51,2020-08-02 01:22:06
i26rcg,MakeMeSuffer,jeordiethegenerator,9663,There's a fungus among us,i.redd.it,https://i.redd.it/fowefq49wie51.jpg,2020-08-02 05:12:46
i26qe6,AnimalsBeingJerks,jrozells,6317,Dogs saying “F*** this lady”,i.redd.it,https://i.redd.it/3hls10itvie51.jpg,2020-08-02 05:10:25
i23vkl,FoodPorn,realdecent,23137,"my partner is Colombian, I’m Korean. this is our attempt at fusion: the bandeja bibimbap",i.redd.it,https://i.redd.it/08zgodwwshe51.jpg,2020-08-02 01:32:17
i24ojj,HolUp,SceneyQueeney,34461,Just thought this might fit in here,i.redd.it,https://i.redd.it/za9zw44f3ie51.jpg,2020-08-02 02:31:10
i25mbn,AnimalCrossing,AdamtheMisfit,10442,I mean... Its true,i.redd.it,https://i.redd.it/4wtj8qf1gie51.jpg,2020-08-02 03:41:54
i28ggt,cursedcomments,Stradyus,5564,cursed_cancer,i.redd.it,https://i.redd.it/fi6jajisoje51.jpg,2020-08-02 07:52:45
i27jio,bonehurtingjuice,AmericanDisgrace,4627,ketchup,i.redd.it,https://i.redd.it/iihwbndw8je51.png,2020-08-02 06:23:40
i26iwj,ShitPostCrusaders,Sheckle_Sniffer,13834,I really like Araki,i.redd.it,https://i.redd.it/lbr3nqjpsie51.jpg,2020-08-02 04:52:55
i257p8,nba,Nyhrox,7748,[Post Game Thread] Toronto Raptors (47-18) defeat Los Angeles Lakers (50-15) by 107 - 92 with 33 points coming from Kyle Lowry,self.nba,https://www.reddit.com/r/nba/comments/i257p8/post_game_thread_toronto_raptors_4718_defeat_los/,2020-08-02 03:10:57
i25xy2,PoliticalCompassMemes,Macksterr24,8481,Peak AuthRight,i.redd.it,https://i.redd.it/r5qh3nwgkie51.jpg,2020-08-02 04:06:44
i24q35,NatureIsFuckingLit,metallicnightmare,17481,"🔥 Black rhinos in Etosha National Park, Namibia",i.redd.it,https://i.redd.it/j2gxsi2ekyq31.jpg,2020-08-02 02:34:16
i23d97,science,Alexander0232,18496,Thermal disinfection successfully decontaminated N95 respirators without impairing structural integrity or function,cmaj.ca,https://www.cmaj.ca/content/early/2020/07/30/cmaj.201203,2020-08-02 00:55:12
i260a8,nevertellmetheodds,memezzer,7728,Home away from home,i.redd.it,https://i.redd.it/eaw3igxclie51.jpg,2020-08-02 04:11:43
i27tsa,dankmemes,XDEC0DE,23648,Gasp...i need to find a job,i.redd.it,https://i.redd.it/pgdte1x1dje51.gif,2020-08-02 06:50:24
i249ct,technicallythetruth,deadeadeadeadeaded,27389,No doubt about it,i.redd.it,https://i.redd.it/plbp6n0wxhe51.jpg,2020-08-02 02:00:09
i25wp4,europe,filosoful,6520,"Mechelen, Belgium.",i.redd.it,https://i.redd.it/1ryktcnkiie51.jpg,2020-08-02 04:04:07
i24fha,dogswithjobs,ForeverSJC,11382,In training to help his future owner,v.redd.it,https://v.redd.it/tnts74kwzhe51,2020-08-02 02:12:09
i299mq,Eyebleach,My_Memes_Will_Cure_U,2158,"Bröther, may I have some lämp?",i.imgur.com,https://i.imgur.com/iI5pgFo.gifv,2020-08-02 09:17:43
i25lg9,TooAfraidToAsk,Gavin_Freedom,7303,"Do you ever hang out with people, have an awesome time, and then as soon as you get back home start to worry about everything you've said, and whether they were just tolerating you the whole time?",self.TooAfraidToAsk,https://www.reddit.com/r/TooAfraidToAsk/comments/i25lg9/do_you_ever_hang_out_with_people_have_an_awesome/,2020-08-02 03:40:05
i29j2g,formula1,barryoke,1832,Claire's reaction to Latifi spinning out of Q1,i.redd.it,https://i.redd.it/jcmw9urm8ke51.gif,2020-08-02 09:44:07
i251p4,news,Wise_Collection,7254,Judge orders man to pay $85K in deaths of 2 whooping cranes,abcnews.go.com,https://abcnews.go.com/US/wireStory/judge-orders-man-pay-85k-deaths-whooping-cranes-72110494,2020-08-02 02:58:42
i251ih,wallstreetbets,LoseALotOfMoney,7815,billy no!,i.redd.it,https://i.redd.it/ehmjb9198ie51.jpg,2020-08-02 02:58:15
i25xvg,AskReddit,fyflate89,9308,[Serious] How would you react if the US government decided that The American Imperial units will be replaced by the metric system?,self.AskReddit,https://www.reddit.com/r/AskReddit/comments/i25xvg/serious_how_would_you_react_if_the_us_government/,2020-08-02 04:06:34
i245ts,TIHI,_NuggyUnyen_,27868,"Thanks, I hate people who sneeze during a panoramic photo",i.redd.it,https://i.redd.it/acroxdeqvhe51.jpg,2020-08-02 01:52:50
i26ihg,insaneparents,Inky-Little-BB,6808,Mother and her boyfriend killed their baby while on drugs and received no jail time. Someone that knew her made a post to help spread the truth while the mom acted like it was some random accident that she had no relation to.,i.redd.it,https://i.redd.it/ep4monijsie51.jpg,2020-08-02 04:51:58
i23i36,ABoringDystopia,outlawsoul,39613,Thanks for your service — but stop resisting fascism.,i.redd.it,https://i.redd.it/c94ku0vynhe51.jpg,2020-08-02 01:04:57
i26rad,Cringetopia,Qpzfd,6527,I still don’t wanna believe this is real.,v.redd.it,https://v.redd.it/t2mfk8t5wie51,2020-08-02 05:12:37
i27z9b,Rainbow6,SulfericPie,3358,1000 iq play from a random,v.redd.it,https://v.redd.it/cf0hv2w3fje51,2020-08-02 07:04:55
i27awc,tumblr,WeabooPolice13,4106,"Kids deserve safety and a good childhood, even if you hate kids you should make sure they have that.",i.redd.it,https://i.redd.it/9gq2g8zt4je51.png,2020-08-02 06:01:18
i25ra0,Art,Stubtoeterra,6844,"The Hermit, Me, watercolour, 2020",i.redd.it,https://i.redd.it/kaptqt2xhie51.jpg,2020-08-02 03:52:26
i24r47,starterpacks,etazhi_,14102,waking up from a long-ass nap starter pack,i.redd.it,https://i.redd.it/dd8msltb4ie51.png,2020-08-02 02:36:28
i280y2,Wellthatsucks,Sheepeh94,3190,"This guy and co lived in the garden as chicks, been feeding them like clockwork each morning ever since. As I went out this morning I heard a large thud - he’d flown into the glass door behind me and died.",i.redd.it,https://i.redd.it/ljc9fbu3hje51.jpg,2020-08-02 07:09:41
i22uam,worldnews,ohnoh18,70452,The US ambassador to Brazil reportedly asked Brazilian officials to help Trump’s reelection,vox.com,https://www.vox.com/policy-and-politics/2020/8/1/21350810/us-ambassador-brazil-chapman-favor-ethanol-trump-reelection,2020-08-02 00:18:03
i26f73,australia,AcornAl,4203,Victoria announces increased coronavirus restrictions,abc.net.au,https://www.abc.net.au/news/2020-08-02/victoria-coronavirus-restrictions-imposed-death-toll-cases-rise/12515914,2020-08-02 04:44:20
i285gk,teenagers,Anish-Roy,4668,My crush agreed to go on a date,self.teenagers,https://www.reddit.com/r/teenagers/comments/i285gk/my_crush_agreed_to_go_on_a_date/,2020-08-02 07:22:05
i25wsd,dndmemes,s_M_e,6139,when you use second wind on the same turn the bbeg heals,v.redd.it,https://v.redd.it/p2zqhpytjie51,2020-08-02 04:04:19
i2692x,ich_iel,Viktor1234678,5988,Ich🐧Iel,i.imgur.com,https://i.imgur.com/vpPKHgK.jpg,2020-08-02 04:31:05
i24yho,apexlegends,zancray,11432,Quality of Life changes,i.redd.it,https://i.redd.it/zhwayp1j6ie51.png,2020-08-02 02:51:53
i28ydd,pcmasterrace,Heckin_Gecker,2191,It gives me a strange sense of power seeing an fps count that big in the corner,i.imgur.com,https://i.imgur.com/sXzYMf2.jpg,2020-08-02 08:44:31
i2932y,memes,lukigaming,11552,Ah yes famous bat soup,i.redd.it,https://i.redd.it/1ww3cbwi0ke51.jpg,2020-08-02 08:59:02
i23xk6,LateStageCapitalism,_Abesti_,9364,Gassing protesters is organic,i.redd.it,https://i.redd.it/ydgrwy69the51.jpg,2020-08-02 01:36:07
i296fg,de,sumpfbieber,1762,"Ruprecht Polenz zum Begriff ""Covidioten""",i.imgur.com,https://i.imgur.com/MSQXefd.jpg,2020-08-02 09:08:25
i272b5,aww,lovejo1,12357,To protect and serve,v.redd.it,https://v.redd.it/kd5en50w0je51,2020-08-02 05:39:08
i246xn,wholesomebpt,WhiskeyStoneCold,8717,Justa friendly reminder,i.redd.it,https://i.redd.it/a2708nhzwhe51.jpg,2020-08-02 01:55:06
i24dra,gadgets,auscrisos,9778,Elon Musk Claims His Mysterious Brain Chip Will Allow People To Hear Previously Impossible Sounds,independent.co.uk,https://www.independent.co.uk/life-style/gadgets-and-tech/news/elon-musk-neuralink-brain-chip-hearing-a9647306.html?amp,2020-08-02 02:08:31
i261oz,DeepFriedMemes,memeified_frog,7163,i would hit the like button because i like pizza credit to the picture of guy on the right (disclaimer: this is just a joke),i.redd.it,https://i.redd.it/0tq52xxqlie51.png,2020-08-02 04:14:58
i256lk,yesyesyesyesno,Trinity8888,8073,Yesyesyesyes. No.,v.redd.it,https://v.redd.it/kccazlqowee51,2020-08-02 03:08:39
i28w9e,interestingasfuck,JBikes,4049,Donald Trump is the first US president in 168 years not to have a pet in the White House.,i.redd.it,https://i.redd.it/6ralldxxwje51.jpg,2020-08-02 08:38:25
i235d7,AnimalsBeingBros,Thoughts-Uncensored,22540,Just looking after my new Siblings 😁😁😁,v.redd.it,https://v.redd.it/irfx7m2bjhe51,2020-08-02 00:38:55
i24lcg,pics,Mexicanuck,26562,Bryan Cranston &amp; Aaron Paul as Hector Salamanca and Pollos Hermanos chicken,i.imgur.com,https://i.imgur.com/XxxhOe5.jpg,2020-08-02 02:24:18
