id,subreddit,author,score,title,domain,url,created_utc
i2bo3t,interestingasfuck,sarahjewel,31616,"Here are my removed &amp; genetically modified white blood cells, about to be put back in to hopefully cure my cancer! This is t-cell immunotherapy!",i.redd.it,https://i.redd.it/g1gln8xo7le51.jpg,2020-08-02 13:00:28
i2b3rv,worldnews,hildebrand_rarity,23112,Americans Go Home: Canadians Track U.S. Boaters Sneaking Across The Border,npr.org,https://www.npr.org/2020/08/02/898165324/americans-go-home-canadians-track-u-s-boaters-sneaking-across-the-border?utm_medium=RSS&amp;utm_campaign=news,2020-08-02 12:15:12
i2d73y,formula1,LordMcze,7610,[@Mercedes-AMG F1] HQYACQUACYQGABAHWVAKDBXKCOEHAPZHXNCYWKAJJZ,twitter.com,https://twitter.com/MercedesAMGF1/status/1289934431059410950?s=19,2020-08-02 14:46:20
i2anbq,assholedesign,Iescaunare,30215,Amazon Prime Video doesn't tell you if a show is unavailable in your country until after you subscribe to Amazon Prime.,i.redd.it,https://i.redd.it/y5gxwuz3ske51.png,2020-08-02 11:34:13
i2b57d,Damnthatsinteresting,Master1718,18105,"Largest Elephant in the world ,8000 kg weight ,TANZANIA.",i.imgur.com,https://i.imgur.com/whNSflo.gifv,2020-08-02 12:18:31
i2aojd,OldSchoolCool,gyrationreproduce,19155,52 years after my dad served on the USS Midway my family toured it and on the wall I found a picture of him sleeping on the Midway at age 18.,i.redd.it,https://i.redd.it/jn5j0astske51.jpg,2020-08-02 11:37:10
i2a9i0,pics,zaynthelegend,42066,Cat snuggled up on statue,i.redd.it,https://i.redd.it/y081ux53mke51.jpg,2020-08-02 10:59:42
i2b05t,PoliticalHumor,MarxReadsRushdie,12132,"Imagine, if you will, an asshole",i.redd.it,https://i.redd.it/2wzzco52yke51.jpg,2020-08-02 12:06:28
i2b4fv,NintendoSwitch,Zarski843,11051,Nintendo is really missing a huge opportunity by not porting Gamecube games over to Switch.,self.NintendoSwitch,https://www.reddit.com/r/NintendoSwitch/comments/i2b4fv/nintendo_is_really_missing_a_huge_opportunity_by/,2020-08-02 12:16:38
i2a4l8,aww,AndyToskovic,35705,Kid meets baby alpaca,v.redd.it,https://v.redd.it/swed3m8njke51,2020-08-02 10:46:03
i2am87,awfuleverything,agentzuko,16036,The fact that this is so common is heartbreaking,i.redd.it,https://i.redd.it/0z8hqb4vrke51.jpg,2020-08-02 11:31:44
i2ar5p,videos,ASparrowe,9356,"My 30y/o mate started skateboarding a few months ago, today he landed his first kickflip, he posts videos for his close friends but i'm so proud i had to share.",youtube.com,https://www.youtube.com/watch?v=tNIoyBoHcL4&amp;t=0s,2020-08-02 11:43:57
i2ancl,nextfuckinglevel,NiceCasualRedditGuy,24045,What it's like to drive in a Seabreacher,v.redd.it,https://v.redd.it/6c6nhzf7ske51,2020-08-02 11:34:17
i2b3mg,PublicFreakout,Ghulam_Jewel,14516,Meeting up with your best friend after a long time,v.redd.it,https://v.redd.it/bk3osryhzke51,2020-08-02 12:14:51
i2aaa7,NatureIsFuckingLit,zaynthelegend,17064,"🔥 Beehive, Honey and Sunlight.",i.redd.it,https://i.redd.it/t7mi0s4gmke51.jpg,2020-08-02 11:01:36
i2a271,memes,sijakas,65687,Confused flat earhers,i.redd.it,https://i.redd.it/56hqjqiaike51.jpg,2020-08-02 10:39:03
i2afjc,news,yalsonbaka,10024,Portland police record highest number of death investigations in single month in more than three decades,oregonlive.com,https://www.oregonlive.com/crime/2020/07/portland-police-record-highest-number-of-death-investigations-in-single-month-in-more-than-three-decades.html,2020-08-02 11:14:48
i2a901,funny,captainyoda69,52911,Poor charlie,i.redd.it,https://i.redd.it/xkzqmtcwlke51.jpg,2020-08-02 10:58:19
i2a6im,mildlyinteresting,atodaso,20974,I roasted the perfect marshmallow.,i.redd.it,https://i.redd.it/d30i7aenkke51.jpg,2020-08-02 10:51:27
i29wmh,CasualUK,allthekos,14191,Sign in the local pub entrance!,i.redd.it,https://i.redd.it/lnr84bzofke51.jpg,2020-08-02 10:23:31
i29vyq,coolguides,PigsFlyOnMars,14793,How much musicians make from streams,i.redd.it,https://i.redd.it/gvzcljbcfke51.jpg,2020-08-02 10:21:33
i29tg1,MadeMeSmile,mayawerrkerceleb,21712,"On Christmas morning after we had opened all the gifts, Travis said he had one more big gift for me. I was a little confused on why he had gotten me a barstool but once I sat down and looked at him, I immediately knew what was happening. He later told me that the stool is from the bar we met",v.redd.it,https://v.redd.it/kw33f27ydke51,2020-08-02 10:14:17
i2a77n,AnimalsBeingDerps,Max2713ger,15478,The perfect pillow doesn't exi-,i.redd.it,https://i.redd.it/zwmf68h0lke51.jpg,2020-08-02 10:53:20
i2b1v5,me_irl,Dafatcheeken,11499,me irl,i.redd.it,https://i.redd.it/ayeqpf3mwke51.jpg,2020-08-02 12:10:29
i2bmsa,tifu,that_filming_guy,6918,TIFU by Becoming a Suspected Pedophile,self.tifu,https://www.reddit.com/r/tifu/comments/i2bmsa/tifu_by_becoming_a_suspected_pedophile/,2020-08-02 12:57:35
i2b710,LeopardsAteMyFace,xbhaskarx,6023,Congressman Louie Gohmert’s (R-TX) daughter: “It’s not worth following a President who has no remorse for leading his followers to an early grave.”,i.imgur.com,https://i.imgur.com/BPb8iwd.jpg,2020-08-02 12:22:45
i2aali,starterpacks,thestreetlife,12656,The 'you haven't lived til you've backpacked through South-East Asia' starter pack,i.redd.it,https://i.redd.it/ecz6v9ximke51.png,2020-08-02 11:02:17
i2au1o,TIHI,AristonD,10183,"Thanks, I hate chicken feet socks.",i.redd.it,https://i.redd.it/jugr869evke51.jpg,2020-08-02 11:51:31
i2911c,mildlyinfuriating,BadUsername25,32819,I can't read the article about pointless monthly subscriptions without buying a monthly subscription,i.redd.it,https://i.redd.it/df70f1ohzje51.png,2020-08-02 08:52:42
i299mq,Eyebleach,My_Memes_Will_Cure_U,29983,"Bröther, may I have some lämp?",i.imgur.com,https://i.imgur.com/iI5pgFo.gifv,2020-08-02 09:17:43
i2az5a,HumansBeingBros,mulmer96,7285,Passed by this laying on the street outside during a walk,i.redd.it,https://i.redd.it/2b6gzacnxke51.jpg,2020-08-02 12:04:10
i29luj,dankmemes,sijakas,56735,We don't want your cringe here,i.redd.it,https://i.redd.it/j01lfkfq9ke51.gif,2020-08-02 09:52:15
i2ai2q,DidntKnowIWantedThat,wheelybindealer,8073,Awesome Carpentry,v.redd.it,https://v.redd.it/krk4w40w8je51,2020-08-02 11:21:12
i2b8gf,insanepeoplefacebook,Active-Ad-233,6411,Couldn't be more convincing,i.redd.it,https://i.redd.it/fmkweb1g1le51.jpg,2020-08-02 12:25:55
i2azla,Minecraft,069420,16411,Slime Volleyball,v.redd.it,https://v.redd.it/o2lgy51rxke51,2020-08-02 12:05:09
i28wfx,Tinder,headpatkelly,30262,i was not prepared for this to work,i.redd.it,https://i.redd.it/t6zjchlywje51.png,2020-08-02 08:38:52
i29j7k,space,gibsonpics,10118,"Since I got into astrophotography I have built my own observatory to capture images of deep space, but my favorite picture I've captured was taken by my RV on the beach. [OC]",i.redd.it,https://i.redd.it/ho5118lp8ke51.jpg,2020-08-02 09:44:30
i28ydd,pcmasterrace,Heckin_Gecker,24217,It gives me a strange sense of power seeing an fps count that big in the corner,i.imgur.com,https://i.imgur.com/sXzYMf2.jpg,2020-08-02 08:44:31
i2atzg,skyrim,WbtoOfficial,5867,Now this is what I call art,i.redd.it,https://i.redd.it/24s8yo9dvke51.jpg,2020-08-02 11:51:22
i28sbt,WTF,Chubk1n,15664,Guy runs onto F1 track during a race!,v.redd.it,https://v.redd.it/mowelesuuje51,2020-08-02 08:27:14
i29rk2,comics,zapphead,7722,[OC] Dungeon Cops #13,i.redd.it,https://i.redd.it/ou5n6881dke51.jpg,2020-08-02 10:08:37
i28h0a,WhitePeopleTwitter,poplitte2,26852,You don't get a pass if you're a woman. Rape is rape.,i.redd.it,https://i.redd.it/244j63o2pje51.jpg,2020-08-02 07:54:20
i2ayhi,greentext,ericliu04,5845,Anon gets a hotdog,i.redd.it,https://i.redd.it/lme1h3ocxke51.jpg,2020-08-02 12:02:30
i2b0s4,cursedcomments,gypsy_fatty,13837,Cursed_plane,i.redd.it,https://i.redd.it/4sfv4ombyke51.jpg,2020-08-02 12:07:57
i294fc,wholesomememes,the_chemist1337,23983,he will be always there,i.redd.it,https://i.redd.it/ox7lcrj91ke51.jpg,2020-08-02 09:02:50
i29b6s,Zoomies,jasontaken,11009,Wholesome in one,i.imgur.com,https://i.imgur.com/jKx3UvB.gifv,2020-08-02 09:22:02
i2ak17,agedlikemilk,ParkSoDamFine,7058,Is that like a personal attack or something?,i.redd.it,https://i.redd.it/71y5z2ptqke51.jpg,2020-08-02 11:26:08
i2ao1c,HongKong,Orhac,5162,"US Senator Josh Hawley had ""Free Hong Kong"" printed on a Houston Rockets basketball jersey",i.redd.it,https://i.redd.it/vayd1408ske51.png,2020-08-02 11:35:59
i2baro,Gamingcirclejerk,IronicIdiot_,4485,"oh nooo, im so scared...",i.redd.it,https://i.redd.it/vi9i8cng2le51.png,2020-08-02 12:31:18
i28azy,MovieDetails,shir0uemiya,37590,"In X-Men First Class, 2011. Hugh Jackman used 8 takes to try to get his line just right. The line was originally, ""fuck off"" but on the 8th take Jackman improvised by saying, ""go fuck yourself""; which became the line used in the film and also gave a genuine reaction from McAvoy and Fassbender.",i.redd.it,https://i.redd.it/h8vsm393mje51.jpg,2020-08-02 07:37:35
i29kgc,Jokes,petrvalasek,13440,How many watermelons can you carry?,self.Jokes,https://www.reddit.com/r/Jokes/comments/i29kgc/how_many_watermelons_can_you_carry/,2020-08-02 09:48:06
i2afg5,gonewild,FloriaDanielson,5148,I’m share nudes on Gonewild everyday but non were ever [f]ocused on my kitty.. okay wow I’m nervous about this🙈,i.redd.it,https://i.redd.it/t88kgersoke51.jpg,2020-08-02 11:14:34
i29ptf,interestingasfuck,zedasd,44692,36 years was taken to make this accurate model of ancient Rome,i.redd.it,https://i.redd.it/1y2r2o05cke51.jpg,2020-08-02 10:03:44
i2c6hk,woahdude,danschaubdesigns,3242,"You liked my other mask, figured I should share my more impressive art",i.redd.it,https://i.redd.it/m5juyibcele51.jpg,2020-08-02 13:37:43
i2bx5n,formuladank,faemsa,3467,Mercedes 1-2 confirmed… :(,i.redd.it,https://i.redd.it/z3x5ifx0ble51.jpg,2020-08-02 13:19:08
i2a2r8,pussypassdenied,Facet101,6180,Typical female friends,i.redd.it,https://i.redd.it/iwggiaprike51.jpg,2020-08-02 10:40:46
i2b2pk,teenagers,Randomaniac03,10643,My crush didn't agree to go on a date,self.teenagers,https://www.reddit.com/r/teenagers/comments/i2b2pk/my_crush_didnt_agree_to_go_on_a_date/,2020-08-02 12:12:38
i28dn5,ProgrammerHumor,DangerousImplication,15184,When you spend so much time multiplying by 2,i.redd.it,https://i.redd.it/1v3wwivdnje51.jpg,2020-08-02 07:44:51
i2cds0,sadcringe,RyanWhittaerFE16,3101,Ahh,i.redd.it,https://i.redd.it/31yrcgozgle51.jpg,2020-08-02 13:52:38
i2aas1,wholesomeanimemes,esk0h,6730,good morning,i.redd.it,https://i.redd.it/re92cduomke51.jpg,2020-08-02 11:02:44
i29kqr,gifsthatkeepongiving,jasontaken,6950,dis mine now,i.imgur.com,https://i.imgur.com/oDvWo3R.gifv,2020-08-02 09:49:00
i28mh2,unpopularopinion,w3stwing,20233,"Caller ID should be mandatory. No person or organization should be able to hide behind ""unknown caller"". If you have access to my phone number and have chosen to contact me, I should have a right to know who you are.",self.unpopularopinion,https://www.reddit.com/r/unpopularopinion/comments/i28mh2/caller_id_should_be_mandatory_no_person_or/,2020-08-02 08:10:02
i2aiet,dontyouknowwhoiam,Cidixat,4537,“Sorry but you really don’t look like someone who likes the Witcher”,i.imgur.com,https://i.imgur.com/EFUcixn.jpg,2020-08-02 11:22:03
i29n2m,comedyheaven,alivefro6,12471,ketchup,i.redd.it,https://i.redd.it/k630dz8rake51.jpg,2020-08-02 09:55:51
i28ddy,FuckYouKaren,Modern_monkcharlie,24374,How dare you?,i.redd.it,https://i.redd.it/46sbro79nje51.png,2020-08-02 07:44:08
i2am8o,clevercomebacks,Active-Ad-233,4904,Couldn't be more convincing,i.redd.it,https://i.redd.it/rri9r7okrke51.jpg,2020-08-02 11:31:46
i28kur,Coronavirus,kogeliz,8820,"White House opposes requirement for passengers to wear masks on planes, trains",reuters.com,https://www.reuters.com/article/us-health-coronavirus-airlines-idUSKCN24V3NC,2020-08-02 08:05:28
i2b80f,dndmemes,DungeonsWithFriends,3675,All That AC And Nothing To Do With It.,i.redd.it,https://i.redd.it/s09nqnbd1le51.jpg,2020-08-02 12:25:01
i2a27g,trashy,KeganO,6189,Such a waste,v.redd.it,https://v.redd.it/hs5522mgike51,2020-08-02 10:39:06
i28iob,technicallythetruth,kj_gamer2614,20298,The real plane facts,i.redd.it,https://i.redd.it/aucbkhlzpje51.jpg,2020-08-02 07:59:26
i2d521,formula1,magony,3706,Hamilton wins the British GP with a blown tire!,streamable.com,https://streamable.com/yjf1d9,2020-08-02 14:42:37
i28vvw,fakehistoryporn,BudgetNOPE,11411,"German pilot explaning the Anakin vs Obi Wan fight scene to his officer. [May 19th, 1944]",i.redd.it,https://i.redd.it/y3pj8jm5wje51.jpg,2020-08-02 08:37:26
i2bszm,AnimalsBeingBros,Scullkrush,3140,Sharing is caring,v.redd.it,https://v.redd.it/qzvs2oqf9le51,2020-08-02 13:10:18
i27tqh,PrequelMemes,Y-Boi,57002,My man was packing it,i.redd.it,https://i.redd.it/yxbx26endje51.jpg,2020-08-02 06:50:18
i280y2,Wellthatsucks,Sheepeh94,24408,"This guy and co lived in the garden as chicks, been feeding them like clockwork each morning ever since. As I went out this morning I heard a large thud - he’d flown into the glass door behind me and died.",i.redd.it,https://i.redd.it/ljc9fbu3hje51.jpg,2020-08-02 07:09:41
i28v0p,DiWHY,Yingluck_Chinawhat,9245,No showerhead? Here use a tap insted,i.redd.it,https://i.redd.it/z58xwu8bwje51.jpg,2020-08-02 08:34:54
i297vn,Overwatch,nephistophiles,8270,I made a current version of that allegiance chart from yesterday,i.redd.it,https://i.redd.it/n0p3v51r0ke51.png,2020-08-02 09:12:29
i2acuv,specializedtools,Better__Off_Dead,4060,Tool to put on/take off clips to hold baseboard corner pieces on before nailing them in place,i.imgur.com,https://i.imgur.com/FKSdkM2.gifv,2020-08-02 11:07:34
i2aisb,DunderMifflin,IVAN2CRY,4307,This was the biggest plot twist in cinema history.,i.redd.it,https://i.redd.it/wuezoexaqke51.jpg,2020-08-02 11:23:02
i29ljf,YouShouldKnow,SweetTeaBags,5915,YSK that you are not a professionally trained therapist and that the burden of helping someone who is suicidal is not on you.,self.YouShouldKnow,https://www.reddit.com/r/YouShouldKnow/comments/i29ljf/ysk_that_you_are_not_a_professionally_trained/,2020-08-02 09:51:16
i2a003,AbruptChaos,NiceEthanoob,5351,half life physics,v.redd.it,https://v.redd.it/htwiy1bdhke51,2020-08-02 10:33:02
i29v68,modernwarfare,WillyWaggler,5289,Today my life peaked,v.redd.it,https://v.redd.it/dgfzaa4ueke51,2020-08-02 10:19:31
i27rxh,politics,sybersonic,11283,Thunder players all kneel during anthem after threat from Oklahoma lawmaker,sports.yahoo.com,https://sports.yahoo.com/oklahoma-lawmaker-threatens-tax-penalties-for-thunder-if-players-kneel-during-anthem-031146336.html,2020-08-02 06:45:08
i27oo0,facepalm,Post-Narrow,64294,MAGA,i.redd.it,https://i.redd.it/kg7dmeszaje51.png,2020-08-02 06:36:32
i2ahqf,trippinthroughtime,f__h,4374,Every single time,i.imgur.com,https://i.imgur.com/P8b7q9X.jpg,2020-08-02 11:20:29
i27fyd,WatchPeopleDieInside,wilymon,48852,Woman prepares for gender reveal party,v.redd.it,https://v.redd.it/k2kmoeq27je51,2020-08-02 06:14:18
i2bcg6,ScottishPeopleTwitter,CookieBitDBC,2918,constant struggle,i.redd.it,https://i.redd.it/38ulxxn53le51.png,2020-08-02 12:35:04
i29vi2,IdiotsInCars,DepressedBagel,5771,thas fucked up,v.redd.it,https://v.redd.it/fd67fw80fke51,2020-08-02 10:20:24
i2awju,dogelore,QazGod,3890,Le questionable trash talking has arrived,i.redd.it,https://i.redd.it/56y40ayiwke51.jpg,2020-08-02 11:57:56
i2775u,KidsAreFuckingStupid,a_bizz,36041,But what if?,i.redd.it,https://i.redd.it/vjply7q53je51.jpg,2020-08-02 05:51:29
i272y8,gifs,Raptor-A,32480,Receipt boomerang,i.redd.it,https://i.redd.it/oj04l1h61je51.gif,2020-08-02 05:40:43
i2akyn,AnimalCrossing,FunkyOperations,4113,"God Lionel, same.",i.redd.it,https://i.redd.it/ajpppsabrke51.jpg,2020-08-02 11:28:40
i28mug,technology,bevmoon,6899,Cosmetics firm Avon leaks 19 million customer records,digitaljournal.com,http://www.digitaljournal.com/tech-and-science/technology/cosmetics-firm-avon-leaks-19-million-customer-records/article/575553,2020-08-02 08:11:07
i26zhv,oddlysatisfying,lifeisalwaysintheway,62980,Car gets fixed. (Last attempt to post in correct format),gfycat.com,https://gfycat.com/immenseeverlastingcrustacean,2020-08-02 05:32:23
i28gw4,instantkarma,c0retison_,14090,Hitting the wrong button.,v.redd.it,https://v.redd.it/e5jao6op3ie51,2020-08-02 07:54:03
i2av0q,dankmemes,RegularNoodles,16938,Step brooo,i.redd.it,https://i.redd.it/dqzh7xgnvke51.gif,2020-08-02 11:54:01
i2azxy,memes,MM0_HD,31949,That's impossible,i.redd.it,https://i.redd.it/mnpy9gwyxke51.jpg,2020-08-02 12:05:58
i28oo4,leagueoflegends,Kyuwice,7819,Met a 4-man party and this is their tactic/strategy every Nexus Blitz game. The enemy golem never moved/attacked us when we are in their side of jungle.,v.redd.it,https://v.redd.it/n9dk0i01tje51,2020-08-02 08:16:39
i29mwy,europe,BlackAdder7,5285,Something all europeans have in common,i.redd.it,https://i.redd.it/f7xu59unake51.jpg,2020-08-02 09:55:20
i28scj,MadeMeSmile,last_slice_of_bread2,38446,When you reunite with your best friend after a long time,v.redd.it,https://v.redd.it/4hp81ocsuje51,2020-08-02 08:27:17
